title,summary,link,published,source,collected_at
Google is pitching an AI agent ecosystem to consumers who may not buy it,"One of the most promising introductions at Google’s I/O developer conference on Tuesday was a new way for consumers to use the web: AI agents. Unfortunately, it was also the most confusing.",https://techcrunch.com/2026/05/21/google-is-pitching-an-ai-agent-ecosystem-to-consumers-who-may-not-buy-it/,"Thu, 21 May 2026 13:52:23 +0000",TechCrunch AI,2026-05-22T14:58:25.221474
"With aluminum prices up 20%, recycling startups bet on AI to cash in","Recycling startups are using AI to improve the recovery of critical minerals like aluminum, aiming to build a massive source of the metal.",https://techcrunch.com/2026/05/21/with-aluminum-prices-up-20-recycling-startups-bet-on-ai-to-cash-in/,"Thu, 21 May 2026 13:38:42 +0000",TechCrunch AI,2026-05-22T14:58:25.221481
Jensen Huang says he’s found a ‘brand new’ $200B market for Nvidia,"The next big thing for Nvidia will be CPUs for AI agents, $200 billion worth, CEO Jensen Huang predicts.",https://techcrunch.com/2026/05/20/jensen-huang-says-hes-found-a-brand-new-200b-market-for-nvidia/,"Thu, 21 May 2026 00:28:31 +0000",TechCrunch AI,2026-05-22T14:58:25.221487
Anthropic says it’s about to have its first profitable quarter,Anthropic has told its investors that it will more than double revenue to around $10.9 billion in its second quarter.,https://techcrunch.com/2026/05/20/anthropic-says-its-about-to-have-its-first-profitable-quarter/,"Thu, 21 May 2026 00:21:21 +0000",TechCrunch AI,2026-05-22T14:58:25.221494
Clouted wants to take the guesswork out of making short videos go viral,The video clipping startup raised a $7 million seed round led by Slow Ventures.,https://techcrunch.com/2026/05/20/clouted-wants-to-take-the-guesswork-out-of-making-short-videos-go-viral/,"Wed, 20 May 2026 22:30:45 +0000",TechCrunch AI,2026-05-22T14:58:25.221501
xAI burned $6.4B last year — SpaceX’s IPO filing shows why the spending is far from over,SpaceX's IPO filing reveals xAI lost $6.4 billion in 2025 while planning a massive Grok expansion — offering the first public look at Elon Musk's AI financials and more details about his ambitions.,https://techcrunch.com/2026/05/20/xai-burned-6-4b-last-year-spacexs-ipo-filing-shows-why-the-spending-is-far-from-over/,"Wed, 20 May 2026 22:26:08 +0000",TechCrunch AI,2026-05-22T14:58:25.221507
"Nvidia posts another record quarter, reveals $43B of holdings in startups","Nvidia announced another record revenue figure after market close on Wednesday, but forecasted that revenue growth would slow in the following quarter.",https://techcrunch.com/2026/05/20/nvidia-posts-another-record-quarter-reveals-43-billion-of-holdings-in-startups/,"Wed, 20 May 2026 22:03:51 +0000",TechCrunch AI,2026-05-22T14:58:25.221514
Musk’s xAI is being sued over its data center generators — now it’s buying $2.8B more,"Elon Musk's xAI said it will buy $2.8 billion worth of natural gas turbines over the next three years, according to SpaceX's IPO filing.",https://techcrunch.com/2026/05/20/musks-xai-is-being-sued-over-its-data-center-generators-now-its-buying-2-8b-more/,"Wed, 20 May 2026 21:55:49 +0000",TechCrunch AI,2026-05-22T14:58:25.221520
Anthropic will pay xAI $1.25B per month for compute,Elon Musk's xAI surprised the AI world when it made a deal to sell compute to Anthropic. Now we know how much it's worth.,https://techcrunch.com/2026/05/20/anthropic-will-pay-xai-1-25-billion-per-month-for-compute/,"Wed, 20 May 2026 21:29:22 +0000",TechCrunch AI,2026-05-22T14:58:25.221526
OpenAI claims it solved an 80-year-old math problem — for real this time,"OpenAI claims its reasoning model disproved a geometry conjecture unsolved since 1946 — and this time, the mathematicians who exposed its last embarrassing claim are backing it up.",https://techcrunch.com/2026/05/20/openai-claims-it-solved-an-80-year-old-math-problem-for-real-this-time/,"Wed, 20 May 2026 20:28:27 +0000",TechCrunch AI,2026-05-22T14:58:25.221533
"IrisGo, a startup backed by Andrew Ng, looks to become the AI desktop buddy you never knew you needed","Initially billed as an ""AI butler,"" Iris watches what happens on a user's desktop and automatically learns how to do tasks for them, its co-founder says.",https://techcrunch.com/2026/05/20/irisgo-a-startup-backed-by-andrew-ng-looks-to-become-the-ai-desktop-buddy-you-never-knew-you-needed/,"Wed, 20 May 2026 19:47:20 +0000",TechCrunch AI,2026-05-22T14:58:25.221539
OpenAI barrels toward IPO that may happen in September,"A day after Elon Musk lost his lawsuit that threatened OpenAI's structure, leadership, and finances, OpenAI is reportedly back to prepping for its IPO.",https://techcrunch.com/2026/05/20/openai-barrels-toward-ipo-that-may-happen-in-september/,"Wed, 20 May 2026 17:24:24 +0000",TechCrunch AI,2026-05-22T14:58:25.221545
Deep ScanAI writing tutor & suggestions,Consulter le site officiel pour lire l'intégralité de l'article.,https://originality.ai/blog/introducing-deep-scan,2026-05-22T14:58:25.882962,Originality.ai Blog,2026-05-22T14:58:25.882978
"FEATUREDOriginality.ai Patented Breakthrough Technology: All-in-One Text Analysis & VerificationLearn about Originality.ai's patented breakthrough technology, a text verification tool that checks for AI, plagiarism, accuracy, readability, and more.Jonathan GillhamMay 21, 2026",Consulter le site officiel pour lire l'intégralité de l'article.,https://originality.ai/blog/originality-ai-patent,2026-05-22T14:58:25.883040,Originality.ai Blog,2026-05-22T14:58:25.883042
"FEATUREDAI Detection Accuracy Studies — Meta-Analysis of 14 StudiesA comprehensive overview and meta-analysis of academic research and studies that demonstrate the exceptional performance of Originality.ai in detecting AI-generated text.Jonathan GillhamApril 1, 2026",Consulter le site officiel pour lire l'intégralité de l'article.,https://originality.ai/blog/ai-detection-studies-round-up,2026-05-22T14:58:25.883064,Originality.ai Blog,2026-05-22T14:58:25.883065
"FEATUREDWe Have 99% Accuracy in Detecting AI: Originality.ai StudyWe believe that it is crucial for AI content detectors reported accuracy to be open, transparent, and accountable. The reality is, each person seeking AI-detection services deserves to know which detector is the most accurate for their specific use case.Jonathan GillhamJanuary 28, 2026",Consulter le site officiel pour lire l'intégralité de l'article.,https://originality.ai/blog/ai-accuracy,2026-05-22T14:58:25.883083,Originality.ai Blog,2026-05-22T14:58:25.883085
AI Fact Checking Accuracy StudyDiscover Originality.ai’s best-in-class fact checker. Find out how the Originality.ai Fact Checker compares to GPT-4o and GPT-5 in this accuracy study.,Consulter le site officiel pour lire l'intégralité de l'article.,https://originality.ai/blog/ai-fact-checking-accuracy,2026-05-22T14:58:25.883121,Originality.ai Blog,2026-05-22T14:58:25.883123
"Introducing: Content Quality ScoreIntroducing Originality.ai Content Quality Score! Discover our latest feature and check how teachers or editors may perceive your essay, paper, or article before it’s submitted.",Consulter le site officiel pour lire l'intégralité de l'article.,https://originality.ai/blog/new-feature-content-quality-score,2026-05-22T14:58:25.883163,Originality.ai Blog,2026-05-22T14:58:25.883165
"Working with a Marketing Agency: 13 Types of Marketing Agencies to KnowFrom full-service to content to SEO, branding and influencers, PPC and more, learn all about the different types of marketing agencies.",Consulter le site officiel pour lire l'intégralité de l'article.,https://originality.ai/blog/types-of-marketing-agencies,2026-05-22T14:58:25.883192,Originality.ai Blog,2026-05-22T14:58:25.883193
Traffic is No Longer the Full Picture: AI Visibility is Essential to TrackThe era of AI search is here. Read our collaborative study with DesignRush to find out what you can do to create quality content that drives traffic and AI citations.,Consulter le site officiel pour lire l'intégralité de l'article.,https://originality.ai/blog/study-content-quality-ai-traffic,2026-05-22T14:58:25.883216,Originality.ai Blog,2026-05-22T14:58:25.883217
"10.6% of Canadian Hiking Guides on Pinterest are Likely AIIs that Canadian hiking guide you’re reading on Pinterest real or likely AI? We studied 1,000 Canadian hiking guides on Pinterest to find out!",Consulter le site officiel pour lire l'intégralité de l'article.,https://originality.ai/blog/likely-ai-canadian-hiking-guides-pinterest,2026-05-22T14:58:25.883241,Originality.ai Blog,2026-05-22T14:58:25.883242
"How To Avoid PlagiarismWhether you’re writing an authoritative article, interviewing an expert, or sharing important findings, you want to avoid taking ideas or concepts from another author and passing them off as your own. At the same time, you want your work to have credibility, and pulling from other sources can add that boost. Plus, in today’s always-on,",Consulter le site officiel pour lire l'intégralité de l'article.,https://originality.ai/blog/how-to-avoid-plagiarism,2026-05-22T14:58:25.883267,Originality.ai Blog,2026-05-22T14:58:25.883268
"What Are The Consequences Of Plagiarism?When talking about “the consequences of plagiarism”, there is no “one size fits all” approach. Plagiarism can be complex and complicated. In this day and age, it’s also becoming increasingly common. That’s why it’s now more important than ever for content publishers and agencies to protect themselves. Although we often talk about plagiarism from an",Consulter le site officiel pour lire l'intégralité de l'article.,https://originality.ai/blog/what-are-the-consequences-of-plagiarism,2026-05-22T14:58:25.883291,Originality.ai Blog,2026-05-22T14:58:25.883293
Is Google Gemini Pro 1.5 Content Detectable?Discover if Google Gemini Pro 1.5 content is detectable. Our study shows 96.4% accuracy with Model 2.0 and 98.4% with 3.0 Turbo. Learn more at Originality.ai!,Consulter le site officiel pour lire l'intégralité de l'article.,https://originality.ai/blog/google-gemini-pro-content-detectable,2026-05-22T14:58:25.883315,Originality.ai Blog,2026-05-22T14:58:25.883317
Can Mixtral AI Content be DetectedCan AI tools spot Mixtral's content? New study reveals detection success rate! See Mixtral AI Content Detection findings now.,Consulter le site officiel pour lire l'intégralité de l'article.,https://originality.ai/blog/can-mixtral-ai-content-be-detected,2026-05-22T14:58:25.883339,Originality.ai Blog,2026-05-22T14:58:25.883340
"UCP (Universal Commerce Protocol), Agentic Commerce Adoption: Live Dashboard & StudyIn 2026, the new UCP (Universal Commerce Protocol) standard was released to support agentic commerce. Is UCP being widely adopted yet? Track UCP agentic commerce adoptions in our tracking study and live dashboard.",Consulter le site officiel pour lire l'intégralité de l'article.,https://originality.ai/blog/ucp-agentic-commerce-adoption-dashboard,2026-05-22T14:58:25.883362,Originality.ai Blog,2026-05-22T14:58:25.883363
"Is GPT-5.5 Content Detectable?In April 2026, GPT-5.5 was released, the smartest model yet, according to OpenAI. However, is the content generated from GPT-5.5 still detectable? Find out in this study!",Consulter le site officiel pour lire l'intégralité de l'article.,https://originality.ai/blog/is-gpt-5-5-detectable,2026-05-22T14:58:25.883384,Originality.ai Blog,2026-05-22T14:58:25.883385
"13.2% of U.S. Hiking Guides on Pinterest are Likely AIIs that US hiking guide you’re reading on Pinterest real or likely AI? We studied 1,000 US hiking guides on Pinterest to find out!",Consulter le site officiel pour lire l'intégralité de l'article.,https://originality.ai/blog/likely-ai-us-hiking-guides-pinterest,2026-05-22T14:58:25.883417,Originality.ai Blog,2026-05-22T14:58:25.883418
"Did DeepSeek Copy ChatGPT and is it Detectable?Using our proprietary Originality.ai AI detection tool, we analyzed DeepSeek Chat to find out if the LLM that disrupted the AI industry is detectable. Plus, see the latest AI detection accuracy for DeepSeek V3.2 (2025) and DeepSeek V4 Flash and V4 Pro (2026).",Consulter le site officiel pour lire l'intégralité de l'article.,https://originality.ai/blog/is-deepseek-detectable,2026-05-22T14:58:25.883441,Originality.ai Blog,2026-05-22T14:58:25.883442
"Is Claude Opus 4.7 Content Detectable?In April 2026, Anthropic released Claude Opus 4.7. Is AI-content generated by Claude Opus 4.7 still detectable? Find out in this study!",Consulter le site officiel pour lire l'intégralité de l'article.,https://originality.ai/blog/is-claude-opus-4-7-detectable,2026-05-22T14:58:25.883462,Originality.ai Blog,2026-05-22T14:58:25.883463
"How Can Students Use AI Ethically? Everything You Need to KnowAI in education is here to stay. Learn how students can use AI responsibly, and prove that their work is their own with tools like the Originality.ai Chrome Extension.",Consulter le site officiel pour lire l'intégralité de l'article.,https://originality.ai/blog/how-can-students-use-ai-ethically,2026-05-22T14:58:25.883486,Originality.ai Blog,2026-05-22T14:58:25.883488
6 Top AI Grading Tools for Teachers in 2026AI grading tools help teachers grade faster and save time. Compare top platforms and features to find the right fit for your classroom and teaching workflow.,Consulter le site officiel pour lire l'intégralité de l'article.,https://originality.ai/blog/ai-grading-tools-for-teachers,2026-05-22T14:58:25.883509,Originality.ai Blog,2026-05-22T14:58:25.883511
"Niche Idea Generator ToolAs you browse through the web looking for new business ideas, you tend to encounter some issues as regards discovering lucrative niche markets. Thanks to the Originality.ai’s niche generator, there is a solution. It effortlessly identifies profitable niches based on realistic market research. By leveraging on trends across numerous search volumes, the niche generator can shine a light on niches primed for growth. What a way to access hidden opportunities in niche markets.",Consulter le site officiel pour lire l'intégralité de l'article.,https://originality.ai/blog/niche-idea-generator,2026-05-22T14:58:25.883532,Originality.ai Blog,2026-05-22T14:58:25.883533
"Is Llama 4 Maverick and Scout AI Content Detectable?Meta released Llama 4 Maverick and Llama 4 Scout in 2025. In this brief study, we reviewed Llama 4 Maverick and Llama 4 Scout to find out if their content is detectable by Originality.ai.",Consulter le site officiel pour lire l'intégralité de l'article.,https://originality.ai/blog/llama-ai-content-detectable,2026-05-22T14:58:25.883556,Originality.ai Blog,2026-05-22T14:58:25.883557
"20+ X (Formerly Twitter) Statistics in 2026Essential Twitter (X) statistics for businesses and marketers in 2026, covering reach, audience, content performance, and more.",Consulter le site officiel pour lire l'intégralité de l'article.,https://originality.ai/blog/twitter-x-statistics,2026-05-22T14:58:25.883578,Originality.ai Blog,2026-05-22T14:58:25.883580
"How LLMs Distort Our Written Language: 5 Key Insights from the 2026 StudyAccording to a 2026 study, LLMs can significantly change the tone, style, and creativity of writing (even when prompted to focus on grammar). Learn the key findings and implications from the study here.",Consulter le site officiel pour lire l'intégralité de l'article.,https://originality.ai/blog/llms-distort-written-language-study-insights,2026-05-22T14:58:25.883599,Originality.ai Blog,2026-05-22T14:58:25.883600
"Conclusion GeneratorSo you've pushed through blank page syndrome, gotten into the zone, and written up stellar content that fits your vision. Your writing starts strong, hits all the right points, and flows nicely. But you're stuck right before the finish line, unsure of how to tie things together well and end with a strong conclusion.",Consulter le site officiel pour lire l'intégralité de l'article.,https://originality.ai/blog/ai-conclusion-generator,2026-05-22T14:58:25.883622,Originality.ai Blog,2026-05-22T14:58:25.883623
"32.4% of Medical Diet Recipes on Pinterest Are Likely AIIs that medical diet recipe you’re reading on Pinterest real or likely AI? We studied over 1,000 medical diet recipes on Pinterest to find out!",Consulter le site officiel pour lire l'intégralité de l'article.,https://originality.ai/blog/likely-ai-medical-diet-recipes-on-pinterest,2026-05-22T14:58:25.883645,Originality.ai Blog,2026-05-22T14:58:25.883646
OpenAI and ChatGPT Lawsuit List (25+ Case Summaries)We looked at all of the lawsuits occurring against OpenAI (ChatGPT) and listed them in this article. Check out a comprehensive list of OpenAI and ChatGPT lawsuits with 25+ case summaries in this article.,Consulter le site officiel pour lire l'intégralité de l'article.,https://originality.ai/blog/openai-chatgpt-lawsuit-list,2026-05-22T14:58:25.883665,Originality.ai Blog,2026-05-22T14:58:25.883666
Is Loopple's AI Review Generator Detectable?Can Originality.ai detect Loopple's Review Generator? Find out in this in-depth Loople review!,Consulter le site officiel pour lire l'intégralité de l'article.,https://originality.ai/blog/loopple-ai-review,2026-05-22T14:58:25.883686,Originality.ai Blog,2026-05-22T14:58:25.883688
Are AI-Generated LinkedIn Captions from OneUp App Detectable?Can OneUp’s LinkedIn Caption Generator get past AI detection? We test its AI LinkedIn caption and share the full results in our OneUp review.,Consulter le site officiel pour lire l'intégralité de l'article.,https://originality.ai/blog/oneup-app-review,2026-05-22T14:58:25.883710,Originality.ai Blog,2026-05-22T14:58:25.883711
AIFreeBox Review: Is Its AI Paper Writer Detectable?Is the AIFreeBox AI Paper Writer detectable? Learn about what the AIFreeBox AI Paper Writer is and whether its copy is detectable in this in-depth review.,Consulter le site officiel pour lire l'intégralité de l'article.,https://originality.ai/blog/aifreebox-review,2026-05-22T14:58:25.883732,Originality.ai Blog,2026-05-22T14:58:25.883734
"Can Humans Detect AI-Generated Text? 6 Studies Would Suggest They Can’tAs AI continues advancing, it’s essential to establish whether humans can identify AI-generated text. To evaluate this further, we reviewed six independent studies on the subject.",Consulter le site officiel pour lire l'intégralité de l'article.,https://originality.ai/blog/can-humans-detect-ai-content,2026-05-22T14:58:25.883775,Originality.ai Blog,2026-05-22T14:58:25.883776
WriteSafe Plagiarism Checker ReviewCan the WriteSafe plagiarism checker detect plagiarism? We tested it against the Originality.ai plagiarism detector. See which tool comes out ahead in our comparative WriteSafe review.,Consulter le site officiel pour lire l'intégralité de l'article.,https://originality.ai/blog/writesafe-plagiarism-review,2026-05-22T14:58:25.883798,Originality.ai Blog,2026-05-22T14:58:25.883799
"20 B2B Marketing Statistics & Insights to Know in 2026Key B2B content marketing statistics businesses and marketers need to know in 2026. See what’s working and where to invest your marketing team’s time, budget, and effort.",Consulter le site officiel pour lire l'intégralité de l'article.,https://originality.ai/blog/b2b-marketing-statistics,2026-05-22T14:58:25.883822,Originality.ai Blog,2026-05-22T14:58:25.883823
"Sentence SimplifierHave you heard about a tool that simply simplifies and summarizes long essays or write-ups for you? Well, the Originality.ai’s Sentence simplifier does just that and more! Imagine reading a bunch of words filled with complicated and advanced words, and you just find it hard to understand what you are reading, then this tool is exactly what you need.",Consulter le site officiel pour lire l'intégralité de l'article.,https://originality.ai/blog/sentence-simplifier,2026-05-22T14:58:25.883846,Originality.ai Blog,2026-05-22T14:58:25.883847
"Text EnhancerClarity in writing is one of the areas that human beings have devoted a lot of their time to cultivating. While correcting grammatical and especially orthographical mistakes using such options as spell check and grammar tools is rather simple, it remains complicated to enrich the deeper parameters of writing. Glad to introduce you to Originality.ai Text Enhancer, which aims to help you address this problem painlessly. The Originality.ai Text Enhancer’s purpose is to enhance your writing style, flow, and use of words and phrases. It also keeps the meaning and intent of your text intact.",Consulter le site officiel pour lire l'intégralité de l'article.,https://originality.ai/blog/text-enhancer,2026-05-22T14:58:25.883870,Originality.ai Blog,2026-05-22T14:58:25.883871
AgencyHandy Review: Are Its AI-Generated Blogs Detectable?Are AI blogs generated by AgencyHandy’s blog generator detectable by AI content detectors? We break down how it works and whether the blogs it generates are detectable as Likely AI in this in-depth review.,Consulter le site officiel pour lire l'intégralité de l'article.,https://originality.ai/blog/agencyhandy-ai-blog-review,2026-05-22T14:58:25.883892,Originality.ai Blog,2026-05-22T14:58:25.883893
Is Mention's LinkedIn Post Generator Detectable?Is Mention's LinkedIn Post Generator detectable? Learn about what the Mention LinkedIn Post Generator is and whether its copy is detectable in this in-depth review.,Consulter le site officiel pour lire l'intégralité de l'article.,https://originality.ai/blog/mention-ai-linkedin-post-review,2026-05-22T14:58:25.883914,Originality.ai Blog,2026-05-22T14:58:25.883915
Nuelink AI LinkedIn Caption Generator: Is It Detectable?Is the Nuelink LinkedIn Caption Generator detectable? Learn about what the Nuelink LinkedIn Caption Generator is and whether its captions are detectable as AI content in this in-depth review.,Consulter le site officiel pour lire l'intégralité de l'article.,https://originality.ai/blog/nuelink-ai-linkedin-caption-review,2026-05-22T14:58:25.883937,Originality.ai Blog,2026-05-22T14:58:25.883938
"YouScan: AI Scanning & Detection ReviewCan YouScan detect AI content from a blog post, promotional email, or research abstract? We put it to the test in this full YouScan review",Consulter le site officiel pour lire l'intégralité de l'article.,https://originality.ai/blog/youscan-review,2026-05-22T14:58:25.883960,Originality.ai Blog,2026-05-22T14:58:25.883961
ToolBaz AI Essay Writer: Is It Detectable?Is the ToolBaz AI Essay Writer detectable? Learn about what the ToolBaz AI Essay Writer is and whether it's detectable in this in-depth article and review.,Consulter le site officiel pour lire l'intégralité de l'article.,https://originality.ai/blog/toolbaz-review,2026-05-22T14:58:25.883986,Originality.ai Blog,2026-05-22T14:58:25.883987
PaperGen AI Writing Assistant: Is Its Content Detectable?Is PaperGen’s AI content detectable by AI detection tools? We test its AI-written outputs on AI detection tools to find out.,Consulter le site officiel pour lire l'intégralité de l'article.,https://originality.ai/blog/papergen-review,2026-05-22T14:58:25.884010,Originality.ai Blog,2026-05-22T14:58:25.884011
"EssayPro: AI Scanning Tool ReviewCan EssayPro detect AI text generated in the style of a blog post, email, or research abstract? See the full test results in our detailed EssayPro review.",Consulter le site officiel pour lire l'intégralité de l'article.,https://originality.ai/blog/essaypro-ai-review,2026-05-22T14:58:25.884034,Originality.ai Blog,2026-05-22T14:58:25.884035
iWeaver AI Review: Are Its AI-Generated Blogs Detectable?Can AI-generated blog posts from iWeaver get past modern AI content detectors? We’ll take an in-depth look at the iWeaver AI blog generator and whether it is detectable in this review.,Consulter le site officiel pour lire l'intégralité de l'article.,https://originality.ai/blog/iweaver-ai-review,2026-05-22T14:58:25.884058,Originality.ai Blog,2026-05-22T14:58:25.884059
"Story GeneratorThe Originality.ai Story Generator is not just a simple tool that produces a plot at random. It is a very complex element that considers such factors as character progression, plot advancement, and the creation of a universe.",Consulter le site officiel pour lire l'intégralité de l'article.,https://originality.ai/blog/story-generator,2026-05-22T14:58:25.884081,Originality.ai Blog,2026-05-22T14:58:25.884083
Is GPT-5.3 Instant and GPT-5.4 Content Detectable?OpenAI just released GPT-5.3 Instant and GPT-5.4 in March 2026. Is GPT-5.3 Instant and GPT-5.4-generated text still detectable as AI by the industry-leading Originality.ai AI Checker? These are our findings.,Consulter le site officiel pour lire l'intégralité de l'article.,https://originality.ai/blog/are-gpt-5-3-and-5-4-detectable,2026-05-22T14:58:25.884103,Originality.ai Blog,2026-05-22T14:58:25.884104
Highperformr AI Blog Post Generator: Is it Detectable?Find out whether the Highperformr AI Blog Post Generator’s blogs are detectable by AI content detectors in this in-depth review.,Consulter le site officiel pour lire l'intégralité de l'article.,https://originality.ai/blog/highperformr-ai-review,2026-05-22T14:58:25.884126,Originality.ai Blog,2026-05-22T14:58:25.884127
5 Top Tools to Identify AI and Plagiarism in 2026Which tools are the best for identifying AI writing and plagiarism? Find out in this top 5 list of AI and plagiarism scanning tools.,Consulter le site officiel pour lire l'intégralité de l'article.,https://originality.ai/blog/identify-ai-plagiarism-top-tools,2026-05-22T14:58:25.884166,Originality.ai Blog,2026-05-22T14:58:25.884168
