title,summary,link,published,source,collected_at
Finetune Stable Diffusion Models with DDPO via TRL,,https://huggingface.co/blog/trl-ddpo,"Fri, 29 Sep 2023 00:00:00 GMT",Hugging Face Blog,2026-05-22T14:58:22.357789
Non-engineers guide: Train a LLaMA 2 chatbot,,https://huggingface.co/blog/Llama2-for-non-engineers,"Thu, 28 Sep 2023 00:00:00 GMT",Hugging Face Blog,2026-05-22T14:58:22.357796
Llama 2 on Amazon SageMaker a Benchmark,,https://huggingface.co/blog/llama-sagemaker-benchmark,"Tue, 26 Sep 2023 00:00:00 GMT",Hugging Face Blog,2026-05-22T14:58:22.357803
Inference for PROs,,https://huggingface.co/blog/inference-pro,"Fri, 22 Sep 2023 00:00:00 GMT",Hugging Face Blog,2026-05-22T14:58:22.357809
Rocket Money x Hugging Face: Scaling Volatile ML Models in Production​,,https://huggingface.co/blog/rocketmoney-case-study,"Tue, 19 Sep 2023 00:00:00 GMT",Hugging Face Blog,2026-05-22T14:58:22.357816
Introduction to 3D Gaussian Splatting,,https://huggingface.co/blog/gaussian-splatting,"Mon, 18 Sep 2023 00:00:00 GMT",Hugging Face Blog,2026-05-22T14:58:22.357823
Object Detection Leaderboard,,https://huggingface.co/blog/object-detection-leaderboard,"Mon, 18 Sep 2023 00:00:00 GMT",Hugging Face Blog,2026-05-22T14:58:22.357832
Optimizing your LLM in production,,https://huggingface.co/blog/optimize-llm,"Fri, 15 Sep 2023 00:00:00 GMT",Hugging Face Blog,2026-05-22T14:58:22.357838
Introducing Würstchen: Fast Diffusion for Image Generation,,https://huggingface.co/blog/wuerstchen,"Wed, 13 Sep 2023 00:00:00 GMT",Hugging Face Blog,2026-05-22T14:58:22.357845
Fine-tuning Llama 2 70B using PyTorch FSDP,,https://huggingface.co/blog/ram-efficient-pytorch-fsdp,"Wed, 13 Sep 2023 00:00:00 GMT",Hugging Face Blog,2026-05-22T14:58:22.357852
Overview of natively supported quantization schemes in 🤗 Transformers,,https://huggingface.co/blog/overview-quantization-transformers,"Tue, 12 Sep 2023 00:00:00 GMT",Hugging Face Blog,2026-05-22T14:58:22.357859
SafeCoder vs. Closed-source Code Assistants,,https://huggingface.co/blog/safecoder-vs-closed-source-code-assistants,"Mon, 11 Sep 2023 00:00:00 GMT",Hugging Face Blog,2026-05-22T14:58:22.357866
Efficient Controllable Generation for SDXL with T2I-Adapters,,https://huggingface.co/blog/t2i-sdxl-adapters,"Fri, 08 Sep 2023 00:00:00 GMT",Hugging Face Blog,2026-05-22T14:58:22.357873
Spread Your Wings: Falcon 180B is here,,https://huggingface.co/blog/falcon-180b,"Wed, 06 Sep 2023 00:00:00 GMT",Hugging Face Blog,2026-05-22T14:58:22.357879
Fetch Cuts ML Processing Latency by 50% Using Amazon SageMaker & Hugging Face,,https://huggingface.co/blog/fetch-case-study,"Fri, 01 Sep 2023 00:00:00 GMT",Hugging Face Blog,2026-05-22T14:58:22.357886
"AudioLDM 2, but faster ⚡️",,https://huggingface.co/blog/audioldm2,"Wed, 30 Aug 2023 00:00:00 GMT",Hugging Face Blog,2026-05-22T14:58:22.357893
Code Llama: Llama 2 learns to code,,https://huggingface.co/blog/codellama,"Fri, 25 Aug 2023 00:00:00 GMT",Hugging Face Blog,2026-05-22T14:58:22.357900
Deprecation of Git Authentication using password,,https://huggingface.co/blog/password-git-deprecation,"Fri, 25 Aug 2023 00:00:00 GMT",Hugging Face Blog,2026-05-22T14:58:22.357907
Making LLMs lighter with AutoGPTQ and transformers,,https://huggingface.co/blog/gptq-integration,"Wed, 23 Aug 2023 00:00:00 GMT",Hugging Face Blog,2026-05-22T14:58:22.357914
Introducing SafeCoder,,https://huggingface.co/blog/safecoder,"Tue, 22 Aug 2023 00:00:00 GMT",Hugging Face Blog,2026-05-22T14:58:22.357921
Introducing IDEFICS: An Open Reproduction of State-of-the-art Visual Langage Model,,https://huggingface.co/blog/idefics,"Tue, 22 Aug 2023 00:00:00 GMT",Hugging Face Blog,2026-05-22T14:58:22.357929
Hugging Face Hub on the AWS Marketplace: Pay with your AWS Account,,https://huggingface.co/blog/aws-marketplace,"Thu, 10 Aug 2023 00:00:00 GMT",Hugging Face Blog,2026-05-22T14:58:22.357936
Optimizing Bark using 🤗 Transformers,,https://huggingface.co/blog/optimizing-bark,"Wed, 09 Aug 2023 00:00:00 GMT",Hugging Face Blog,2026-05-22T14:58:22.357942
Deploying Hugging Face Models with BentoML: DeepFloyd IF in Action,,https://huggingface.co/blog/deploy-deepfloydif-using-bentoml,"Wed, 09 Aug 2023 00:00:00 GMT",Hugging Face Blog,2026-05-22T14:58:22.357949
Fine-tune Llama 2 with DPO,,https://huggingface.co/blog/dpo-trl,"Tue, 08 Aug 2023 00:00:00 GMT",Hugging Face Blog,2026-05-22T14:58:22.357956
Releasing Swift Transformers: Run On-Device LLMs in Apple Devices,,https://huggingface.co/blog/swift-coreml-llm,"Tue, 08 Aug 2023 00:00:00 GMT",Hugging Face Blog,2026-05-22T14:58:22.357963
Deploy MusicGen in no time with Inference Endpoints,,https://huggingface.co/blog/run-musicgen-as-an-api,"Fri, 04 Aug 2023 00:00:00 GMT",Hugging Face Blog,2026-05-22T14:58:22.357969
Huggy Lingo: Using Machine Learning to Improve Language Metadata on the Hugging Face Hub,,https://huggingface.co/blog/huggy-lingo,"Wed, 02 Aug 2023 00:00:00 GMT",Hugging Face Blog,2026-05-22T14:58:22.357976
Towards Encrypted Large Language Models with FHE,,https://huggingface.co/blog/encrypted-llm,"Wed, 02 Aug 2023 00:00:00 GMT",Hugging Face Blog,2026-05-22T14:58:22.357983
Practical 3D Asset Generation: A Step-by-Step Guide,,https://huggingface.co/blog/3d-assets,"Tue, 01 Aug 2023 00:00:00 GMT",Hugging Face Blog,2026-05-22T14:58:22.357989
Open-sourcing Knowledge Distillation Code and Weights of SD-Small and SD-Tiny,,https://huggingface.co/blog/sd_distillation,"Tue, 01 Aug 2023 00:00:00 GMT",Hugging Face Blog,2026-05-22T14:58:22.357996
Stable Diffusion XL on Mac with Advanced Core ML Quantization,,https://huggingface.co/blog/stable-diffusion-xl-coreml,"Thu, 27 Jul 2023 00:00:00 GMT",Hugging Face Blog,2026-05-22T14:58:22.358003
AI Policy @🤗: Open ML Considerations in the EU AI Act,,https://huggingface.co/blog/eu-ai-act-oss,"Mon, 24 Jul 2023 00:00:00 GMT",Hugging Face Blog,2026-05-22T14:58:22.358009
Introducing Agents.js: Give tools to your LLMs using JavaScript,,https://huggingface.co/blog/agents-js,"Mon, 24 Jul 2023 00:00:00 GMT",Hugging Face Blog,2026-05-22T14:58:22.358018
Results of the Open Source AI Game Jam,,https://huggingface.co/blog/game-jam-first-edition-results,"Fri, 21 Jul 2023 00:00:00 GMT",Hugging Face Blog,2026-05-22T14:58:22.358025
Happy 1st anniversary 🤗 Diffusers!,,https://huggingface.co/blog/diffusers-turns-1,"Thu, 20 Jul 2023 00:00:00 GMT",Hugging Face Blog,2026-05-22T14:58:22.358032
Llama 2 is here - get it on Hugging Face,,https://huggingface.co/blog/llama2,"Tue, 18 Jul 2023 00:00:00 GMT",Hugging Face Blog,2026-05-22T14:58:22.358039
Building an AI WebTV,,https://huggingface.co/blog/ai-webtv,"Mon, 17 Jul 2023 00:00:00 GMT",Hugging Face Blog,2026-05-22T14:58:22.358046
Open-Source Text Generation & LLM Ecosystem at Hugging Face,,https://huggingface.co/blog/os-llms,"Mon, 17 Jul 2023 00:00:00 GMT",Hugging Face Blog,2026-05-22T14:58:22.358052
Fine-tuning Stable Diffusion models on Intel CPUs,,https://huggingface.co/blog/stable-diffusion-finetuning-intel,"Fri, 14 Jul 2023 00:00:00 GMT",Hugging Face Blog,2026-05-22T14:58:22.358059
Making ML-powered web games with Transformers.js,,https://huggingface.co/blog/ml-web-games,"Wed, 05 Jul 2023 00:00:00 GMT",Hugging Face Blog,2026-05-22T14:58:22.358068
Deploy LLMs with Hugging Face Inference Endpoints,,https://huggingface.co/blog/inference-endpoints-llm,"Tue, 04 Jul 2023 00:00:00 GMT",Hugging Face Blog,2026-05-22T14:58:22.358075
Making a web app generator with open ML models,,https://huggingface.co/blog/text-to-webapp,"Mon, 03 Jul 2023 00:00:00 GMT",Hugging Face Blog,2026-05-22T14:58:22.358081
Leveraging Hugging Face for complex generative AI use cases,,https://huggingface.co/blog/writer-case-study,"Sat, 01 Jul 2023 00:00:00 GMT",Hugging Face Blog,2026-05-22T14:58:22.358088
Accelerating Vision-Language Models: BridgeTower on Habana Gaudi2,,https://huggingface.co/blog/bridgetower,"Thu, 29 Jun 2023 00:00:00 GMT",Hugging Face Blog,2026-05-22T14:58:22.358095
Ethics and Society Newsletter #4: Bias in Text-to-Image Models,,https://huggingface.co/blog/ethics-soc-4,"Mon, 26 Jun 2023 00:00:00 GMT",Hugging Face Blog,2026-05-22T14:58:22.358102
What's going on with the Open LLM Leaderboard?,,https://huggingface.co/blog/open-llm-leaderboard-mmlu,"Fri, 23 Jun 2023 00:00:00 GMT",Hugging Face Blog,2026-05-22T14:58:22.358114
Panel on Hugging Face,,https://huggingface.co/blog/panel-on-hugging-face,"Thu, 22 Jun 2023 00:00:00 GMT",Hugging Face Blog,2026-05-22T14:58:22.358121
AI Policy @🤗: Response to the U.S. NTIA's Request for Comment on AI Accountability,,https://huggingface.co/blog/policy-ntia-rfc,"Tue, 20 Jun 2023 00:00:00 GMT",Hugging Face Blog,2026-05-22T14:58:22.358128
Fine-Tune MMS Adapter Models for low-resource ASR,,https://huggingface.co/blog/mms_adapters,"Mon, 19 Jun 2023 00:00:00 GMT",Hugging Face Blog,2026-05-22T14:58:22.358147
"Yes, Transformers are Effective for Time Series Forecasting (+ Autoformer)",,https://huggingface.co/blog/autoformer,"Fri, 16 Jun 2023 00:00:00 GMT",Hugging Face Blog,2026-05-22T14:58:22.358155
"Faster Stable Diffusion with Core ML on iPhone, iPad, and Mac",,https://huggingface.co/blog/fast-diffusers-coreml,"Thu, 15 Jun 2023 00:00:00 GMT",Hugging Face Blog,2026-05-22T14:58:22.358162
Deploy Livebook notebooks as apps to Hugging Face Spaces,,https://huggingface.co/blog/livebook-app-deployment,"Thu, 15 Jun 2023 00:00:00 GMT",Hugging Face Blog,2026-05-22T14:58:22.358170
Announcing our new Content Guidelines and Policy,,https://huggingface.co/blog/content-guidelines-update,"Thu, 15 Jun 2023 00:00:00 GMT",Hugging Face Blog,2026-05-22T14:58:22.358177
Hugging Face and AMD partner on accelerating state-of-the-art models for CPU and GPU platforms,,https://huggingface.co/blog/huggingface-and-amd,"Tue, 13 Jun 2023 00:00:00 GMT",Hugging Face Blog,2026-05-22T14:58:22.358184
Can foundation models label data like humans?,,https://huggingface.co/blog/open-llm-leaderboard-rlhf,"Mon, 12 Jun 2023 00:00:00 GMT",Hugging Face Blog,2026-05-22T14:58:22.358190
"The Hugging Face Hub for Galleries, Libraries, Archives and Museums",,https://huggingface.co/blog/hf-hub-glam-guide,"Mon, 12 Jun 2023 00:00:00 GMT",Hugging Face Blog,2026-05-22T14:58:22.358197
"DuckDB: analyze 50,000+ datasets stored on the Hugging Face Hub",,https://huggingface.co/blog/hub-duckdb,"Wed, 07 Jun 2023 00:00:00 GMT",Hugging Face Blog,2026-05-22T14:58:22.358203
Welcome fastText to the Hugging Face Hub,,https://huggingface.co/blog/fasttext,"Tue, 06 Jun 2023 00:00:00 GMT",Hugging Face Blog,2026-05-22T14:58:22.358210
The Falcon has landed in the Hugging Face ecosystem,,https://huggingface.co/blog/falcon,"Mon, 05 Jun 2023 00:00:00 GMT",Hugging Face Blog,2026-05-22T14:58:22.358220
AI Speech Recognition in Unity,,https://huggingface.co/blog/unity-asr,"Fri, 02 Jun 2023 00:00:00 GMT",Hugging Face Blog,2026-05-22T14:58:22.358226
Announcing the Open Source AI Game Jam 🎮,,https://huggingface.co/blog/game-jam,"Thu, 01 Jun 2023 00:00:00 GMT",Hugging Face Blog,2026-05-22T14:58:22.358233
Introducing the Hugging Face LLM Inference Container for Amazon SageMaker,,https://huggingface.co/blog/sagemaker-huggingface-llm,"Wed, 31 May 2023 00:00:00 GMT",Hugging Face Blog,2026-05-22T14:58:22.358240
Introducing BERTopic Integration with the Hugging Face Hub,,https://huggingface.co/blog/bertopic,"Wed, 31 May 2023 00:00:00 GMT",Hugging Face Blog,2026-05-22T14:58:22.358247
Optimizing Stable Diffusion for Intel CPUs with NNCF and 🤗 Optimum,,https://huggingface.co/blog/train-optimize-sd-intel,"Thu, 25 May 2023 00:00:00 GMT",Hugging Face Blog,2026-05-22T14:58:22.358254
"Making LLMs even more accessible with bitsandbytes, 4-bit quantization and QLoRA",,https://huggingface.co/blog/4bit-transformers-bitsandbytes,"Wed, 24 May 2023 00:00:00 GMT",Hugging Face Blog,2026-05-22T14:58:22.358260
Hugging Face Collaborates with Microsoft to launch Hugging Face Model Catalog on Azure,,https://huggingface.co/blog/hugging-face-endpoints-on-azure,"Wed, 24 May 2023 00:00:00 GMT",Hugging Face Blog,2026-05-22T14:58:22.358267
"Hugging Face and IBM partner on watsonx.ai, the next-generation enterprise studio for AI builders",,https://huggingface.co/blog/huggingface-and-ibm,"Tue, 23 May 2023 00:00:00 GMT",Hugging Face Blog,2026-05-22T14:58:22.358274
🐶Safetensors audited as really safe and becoming the default,,https://huggingface.co/blog/safetensors-security-audit,"Tue, 23 May 2023 00:00:00 GMT",Hugging Face Blog,2026-05-22T14:58:22.358280
Instruction-tuning Stable Diffusion with InstructPix2Pix,,https://huggingface.co/blog/instruction-tuning-sd,"Tue, 23 May 2023 00:00:00 GMT",Hugging Face Blog,2026-05-22T14:58:22.358287
Large-scale Near-deduplication Behind BigCode,,https://huggingface.co/blog/dedup,"Tue, 16 May 2023 00:00:00 GMT",Hugging Face Blog,2026-05-22T14:58:22.358294
"Smaller is better: Q8-Chat, an efficient generative AI experience on Xeon",,https://huggingface.co/blog/generative-ai-models-on-intel-cpu,"Tue, 16 May 2023 00:00:00 GMT",Hugging Face Blog,2026-05-22T14:58:22.358301
Hugging Face Selected for the French Data Protection Agency Enhanced Support Program,,https://huggingface.co/blog/cnil,"Mon, 15 May 2023 00:00:00 GMT",Hugging Face Blog,2026-05-22T14:58:22.358307
Run a Chatgpt-like Chatbot on a Single GPU with ROCm,,https://huggingface.co/blog/chatbot-amd-gpu,"Mon, 15 May 2023 00:00:00 GMT",Hugging Face Blog,2026-05-22T14:58:22.358318
Introducing RWKV - An RNN with the advantages of a transformer,,https://huggingface.co/blog/rwkv,"Mon, 15 May 2023 00:00:00 GMT",Hugging Face Blog,2026-05-22T14:58:22.358325
Assisted Generation: a new direction toward low-latency text generation,,https://huggingface.co/blog/assisted-generation,"Thu, 11 May 2023 00:00:00 GMT",Hugging Face Blog,2026-05-22T14:58:22.358332
Creating a Coding Assistant with StarCoder,,https://huggingface.co/blog/starchat-alpha,"Tue, 09 May 2023 00:00:00 GMT",Hugging Face Blog,2026-05-22T14:58:22.358339
A Dive into Text-to-Video Models,,https://huggingface.co/blog/text-to-video,"Mon, 08 May 2023 00:00:00 GMT",Hugging Face Blog,2026-05-22T14:58:22.358347
StarCoder: A State-of-the-Art LLM for Code,,https://huggingface.co/blog/starcoder,"Thu, 04 May 2023 00:00:00 GMT",Hugging Face Blog,2026-05-22T14:58:22.358354
How to Install and Use the Hugging Face Unity API,,https://huggingface.co/blog/unity-api,"Mon, 01 May 2023 00:00:00 GMT",Hugging Face Blog,2026-05-22T14:58:22.358360
Training a language model with 🤗 Transformers using TensorFlow and TPUs,,https://huggingface.co/blog/tf_tpu,"Thu, 27 Apr 2023 00:00:00 GMT",Hugging Face Blog,2026-05-22T14:58:22.358367
Running IF with 🧨 diffusers on a Free Tier Google Colab,,https://huggingface.co/blog/if,"Wed, 26 Apr 2023 00:00:00 GMT",Hugging Face Blog,2026-05-22T14:58:22.358374
Databricks ❤️ Hugging Face: up to 40% faster training and tuning of Large Language Models,,https://huggingface.co/blog/databricks-case-study,"Wed, 26 Apr 2023 00:00:00 GMT",Hugging Face Blog,2026-05-22T14:58:22.358380
Introducing HuggingFace blog for Chinese speakers: Fostering Collaboration with the Chinese AI community,,https://huggingface.co/blog/chinese-language-blog,"Mon, 24 Apr 2023 00:00:00 GMT",Hugging Face Blog,2026-05-22T14:58:22.358387
How to host a Unity game in a Space,,https://huggingface.co/blog/unity-in-spaces,"Fri, 21 Apr 2023 00:00:00 GMT",Hugging Face Blog,2026-05-22T14:58:22.358394
Accelerating Hugging Face Transformers with AWS Inferentia2,,https://huggingface.co/blog/accelerate-transformers-with-inferentia2,"Mon, 17 Apr 2023 00:00:00 GMT",Hugging Face Blog,2026-05-22T14:58:22.358401
Graph Classification with Transformers,,https://huggingface.co/blog/graphml-classification,"Fri, 14 Apr 2023 00:00:00 GMT",Hugging Face Blog,2026-05-22T14:58:22.358410
Creating Privacy Preserving AI with Substra,,https://huggingface.co/blog/owkin-substra,"Wed, 12 Apr 2023 00:00:00 GMT",Hugging Face Blog,2026-05-22T14:58:22.358417
Snorkel AI x Hugging Face: unlock foundation models for enterprises,,https://huggingface.co/blog/snorkel-case-study,"Thu, 06 Apr 2023 00:00:00 GMT",Hugging Face Blog,2026-05-22T14:58:22.358423
StackLLaMA: A hands-on guide to train LLaMA with RLHF,,https://huggingface.co/blog/stackllama,"Wed, 05 Apr 2023 00:00:00 GMT",Hugging Face Blog,2026-05-22T14:58:22.358430
Ethics and Society Newsletter #3: Ethical Openness at Hugging Face,,https://huggingface.co/blog/ethics-soc-3,"Thu, 30 Mar 2023 00:00:00 GMT",Hugging Face Blog,2026-05-22T14:58:22.358437
Fast Inference on Large Language Models: BLOOMZ on Habana Gaudi2 Accelerator,,https://huggingface.co/blog/habana-gaudi-2-bloom,"Tue, 28 Mar 2023 00:00:00 GMT",Hugging Face Blog,2026-05-22T14:58:22.358445
Accelerating Stable Diffusion Inference on Intel CPUs,,https://huggingface.co/blog/stable-diffusion-inference-intel,"Tue, 28 Mar 2023 00:00:00 GMT",Hugging Face Blog,2026-05-22T14:58:22.358452
Federated Learning using Hugging Face and Flower,,https://huggingface.co/blog/fl-with-flower,"Mon, 27 Mar 2023 00:00:00 GMT",Hugging Face Blog,2026-05-22T14:58:22.358459
Train your ControlNet with diffusers,,https://huggingface.co/blog/train-your-controlnet,"Fri, 24 Mar 2023 00:00:00 GMT",Hugging Face Blog,2026-05-22T14:58:22.358466
Jupyter X Hugging Face,,https://huggingface.co/blog/notebooks-hub,"Thu, 23 Mar 2023 00:00:00 GMT",Hugging Face Blog,2026-05-22T14:58:22.358473
Multivariate Probabilistic Time Series Forecasting with Informer,,https://huggingface.co/blog/informer,"Fri, 10 Mar 2023 00:00:00 GMT",Hugging Face Blog,2026-05-22T14:58:22.358480
Fine-tuning 20B LLMs with RLHF on a 24GB consumer GPU,,https://huggingface.co/blog/trl-peft,"Thu, 09 Mar 2023 00:00:00 GMT",Hugging Face Blog,2026-05-22T14:58:22.358487
New ViT and ALIGN Models From Kakao Brain,,https://huggingface.co/blog/vit-align,"Mon, 06 Mar 2023 00:00:00 GMT",Hugging Face Blog,2026-05-22T14:58:22.358494
Using Machine Learning to Aid Survivors and Race through Time,,https://huggingface.co/blog/using-ml-for-disasters,"Fri, 03 Mar 2023 00:00:00 GMT",Hugging Face Blog,2026-05-22T14:58:22.358502
ControlNet in 🧨 Diffusers,,https://huggingface.co/blog/controlnet,"Fri, 03 Mar 2023 00:00:00 GMT",Hugging Face Blog,2026-05-22T14:58:22.358509
Ethical Guidelines for developing the Diffusers library,,https://huggingface.co/blog/ethics-diffusers,"Thu, 02 Mar 2023 00:00:00 GMT",Hugging Face Blog,2026-05-22T14:58:22.358516
How Hugging Face Accelerated Development of Witty Works Writing Assistant,,https://huggingface.co/blog/classification-use-cases,"Wed, 01 Mar 2023 00:00:00 GMT",Hugging Face Blog,2026-05-22T14:58:22.358523
Red-Teaming Large Language Models,,https://huggingface.co/blog/red-teaming,"Fri, 24 Feb 2023 00:00:00 GMT",Hugging Face Blog,2026-05-22T14:58:22.358529
Swift 🧨Diffusers - Fast Stable Diffusion for Mac,,https://huggingface.co/blog/fast-mac-diffusers,"Fri, 24 Feb 2023 00:00:00 GMT",Hugging Face Blog,2026-05-22T14:58:22.358536
Fetch Consolidates AI Tools and Saves 30% Development Time with Hugging Face on AWS,,https://huggingface.co/blog/fetch-eap-case-study,"Thu, 23 Feb 2023 00:00:00 GMT",Hugging Face Blog,2026-05-22T14:58:22.358543
Hugging Face and AWS partner to make AI more accessible,,https://huggingface.co/blog/aws-partnership,"Tue, 21 Feb 2023 00:00:00 GMT",Hugging Face Blog,2026-05-22T14:58:22.358550
Zero-shot image-to-text generation with BLIP-2,,https://huggingface.co/blog/blip-2,"Wed, 15 Feb 2023 00:00:00 GMT",Hugging Face Blog,2026-05-22T14:58:22.358557
"Why we’re switching to Hugging Face Inference Endpoints, and maybe you should too",,https://huggingface.co/blog/mantis-case-study,"Wed, 15 Feb 2023 00:00:00 GMT",Hugging Face Blog,2026-05-22T14:58:22.358564
Parameter-Efficient Fine-Tuning using 🤗 PEFT,,https://huggingface.co/blog/peft,"Fri, 10 Feb 2023 00:00:00 GMT",Hugging Face Blog,2026-05-22T14:58:22.358570
"Speech Synthesis, Recognition, and More With SpeechT5",,https://huggingface.co/blog/speecht5,"Wed, 08 Feb 2023 00:00:00 GMT",Hugging Face Blog,2026-05-22T14:58:22.358577
Generating Stories: AI for Game Development #5,,https://huggingface.co/blog/ml-for-games-5,"Tue, 07 Feb 2023 00:00:00 GMT",Hugging Face Blog,2026-05-22T14:58:22.358584
Introducing ⚔️ AI vs. AI ⚔️ a deep reinforcement learning multi-agents competition system,,https://huggingface.co/blog/aivsai,"Tue, 07 Feb 2023 00:00:00 GMT",Hugging Face Blog,2026-05-22T14:58:22.358593
Accelerating PyTorch Transformers with Intel Sapphire Rapids - part 2,,https://huggingface.co/blog/intel-sapphire-rapids-inference,"Mon, 06 Feb 2023 00:00:00 GMT",Hugging Face Blog,2026-05-22T14:58:22.358599
A Dive into Vision-Language Models,,https://huggingface.co/blog/vision_language_pretraining,"Fri, 03 Feb 2023 00:00:00 GMT",Hugging Face Blog,2026-05-22T14:58:22.358606
The State of Computer Vision at Hugging Face 🤗,,https://huggingface.co/blog/cv_state,"Mon, 30 Jan 2023 00:00:00 GMT",Hugging Face Blog,2026-05-22T14:58:22.358613
2D Asset Generation: AI for Game Development #4,,https://huggingface.co/blog/ml-for-games-4,"Thu, 26 Jan 2023 00:00:00 GMT",Hugging Face Blog,2026-05-22T14:58:22.358620
Using LoRA for Efficient Stable Diffusion Fine-Tuning,,https://huggingface.co/blog/lora,"Thu, 26 Jan 2023 00:00:00 GMT",Hugging Face Blog,2026-05-22T14:58:22.358627
What Makes a Dialog Agent Useful?,,https://huggingface.co/blog/dialog-agents,"Tue, 24 Jan 2023 00:00:00 GMT",Hugging Face Blog,2026-05-22T14:58:22.358634
"Optimum+ONNX Runtime - Easier, Faster training for your Hugging Face models",,https://huggingface.co/blog/optimum-onnxruntime-training,"Tue, 24 Jan 2023 00:00:00 GMT",Hugging Face Blog,2026-05-22T14:58:22.358640
3D Asset Generation: AI for Game Development #3,,https://huggingface.co/blog/ml-for-games-3,"Fri, 20 Jan 2023 00:00:00 GMT",Hugging Face Blog,2026-05-22T14:58:22.358647
Universal Image Segmentation with Mask2Former and OneFormer,,https://huggingface.co/blog/mask2former,"Thu, 19 Jan 2023 00:00:00 GMT",Hugging Face Blog,2026-05-22T14:58:22.358654
Welcome PaddlePaddle to the Hugging Face Hub,,https://huggingface.co/blog/paddlepaddle,"Tue, 17 Jan 2023 00:00:00 GMT",Hugging Face Blog,2026-05-22T14:58:22.358661
Image Similarity with Hugging Face Datasets and Transformers,,https://huggingface.co/blog/image-similarity,"Mon, 16 Jan 2023 00:00:00 GMT",Hugging Face Blog,2026-05-22T14:58:22.358667
AI for Game Development: Creating a Farming Game in 5 Days. Part 2,,https://huggingface.co/blog/ml-for-games-2,"Mon, 09 Jan 2023 00:00:00 GMT",Hugging Face Blog,2026-05-22T14:58:22.358674
Introduction to Graph Machine Learning,,https://huggingface.co/blog/intro-graphml,"Tue, 03 Jan 2023 00:00:00 GMT",Hugging Face Blog,2026-05-22T14:58:22.358681
AI for Game Development: Creating a Farming Game in 5 Days. Part 1,,https://huggingface.co/blog/ml-for-games-1,"Mon, 02 Jan 2023 00:00:00 GMT",Hugging Face Blog,2026-05-22T14:58:22.358690
Accelerating PyTorch Transformers with Intel Sapphire Rapids - part 1,,https://huggingface.co/blog/intel-sapphire-rapids,"Mon, 02 Jan 2023 00:00:00 GMT",Hugging Face Blog,2026-05-22T14:58:22.358697
Zero-shot image segmentation with CLIPSeg,,https://huggingface.co/blog/clipseg-zero-shot,"Wed, 21 Dec 2022 00:00:00 GMT",Hugging Face Blog,2026-05-22T14:58:22.358704
Model Cards,,https://huggingface.co/blog/model-cards,"Tue, 20 Dec 2022 00:00:00 GMT",Hugging Face Blog,2026-05-22T14:58:22.358711
Let's talk about biases in machine learning! Ethics and Society Newsletter #2,,https://huggingface.co/blog/ethics-soc-2,"Thu, 15 Dec 2022 00:00:00 GMT",Hugging Face Blog,2026-05-22T14:58:22.358717
A Complete Guide to Audio Datasets,,https://huggingface.co/blog/audio-datasets,"Thu, 15 Dec 2022 00:00:00 GMT",Hugging Face Blog,2026-05-22T14:58:22.358724
Faster Training and Inference: Habana Gaudi®2 vs Nvidia A100 80GB,,https://huggingface.co/blog/habana-gaudi-2-benchmark,"Wed, 14 Dec 2022 00:00:00 GMT",Hugging Face Blog,2026-05-22T14:58:22.358731
Illustrating Reinforcement Learning from Human Feedback (RLHF),,https://huggingface.co/blog/rlhf,"Fri, 09 Dec 2022 00:00:00 GMT",Hugging Face Blog,2026-05-22T14:58:22.358738
From GPT2 to Stable Diffusion: Hugging Face arrives to the Elixir community,,https://huggingface.co/blog/elixir-bumblebee,"Fri, 09 Dec 2022 00:00:00 GMT",Hugging Face Blog,2026-05-22T14:58:22.358745
Deep Learning with Proteins,,https://huggingface.co/blog/deep-learning-with-proteins,"Fri, 02 Dec 2022 00:00:00 GMT",Hugging Face Blog,2026-05-22T14:58:22.358752
Using Stable Diffusion with Core ML on Apple Silicon,,https://huggingface.co/blog/diffusers-coreml,"Thu, 01 Dec 2022 00:00:00 GMT",Hugging Face Blog,2026-05-22T14:58:22.358759
Probabilistic Time Series Forecasting with 🤗 Transformers,,https://huggingface.co/blog/time-series-transformers,"Thu, 01 Dec 2022 00:00:00 GMT",Hugging Face Blog,2026-05-22T14:58:22.358765
VQ-Diffusion,,https://huggingface.co/blog/vq-diffusion,"Wed, 30 Nov 2022 00:00:00 GMT",Hugging Face Blog,2026-05-22T14:58:22.358772
We are hiring interns!,,https://huggingface.co/blog/interns-2023,"Tue, 29 Nov 2022 00:00:00 GMT",Hugging Face Blog,2026-05-22T14:58:22.358784
Diffusion Models Live Event,,https://huggingface.co/blog/diffusion-models-event,"Fri, 25 Nov 2022 00:00:00 GMT",Hugging Face Blog,2026-05-22T14:58:22.358791
Director of Machine Learning Insights [Part 4],,https://huggingface.co/blog/ml-director-insights-4,"Wed, 23 Nov 2022 00:00:00 GMT",Hugging Face Blog,2026-05-22T14:58:22.358798
Accelerating Document AI,,https://huggingface.co/blog/document-ai,"Mon, 21 Nov 2022 00:00:00 GMT",Hugging Face Blog,2026-05-22T14:58:22.358806
An overview of inference solutions on Hugging Face,,https://huggingface.co/blog/inference-update,"Mon, 21 Nov 2022 00:00:00 GMT",Hugging Face Blog,2026-05-22T14:58:22.358813
Hugging Face Machine Learning Demos on arXiv,,https://huggingface.co/blog/arxiv,"Thu, 17 Nov 2022 00:00:00 GMT",Hugging Face Blog,2026-05-22T14:58:22.358820
