title,summary,link,published,source,collected_at
Finetune Stable Diffusion Models with DDPO via TRL,,https://huggingface.co/blog/trl-ddpo,"Fri, 29 Sep 2023 00:00:00 GMT",Hugging Face Blog,2026-05-22T10:45:41.864504
Non-engineers guide: Train a LLaMA 2 chatbot,,https://huggingface.co/blog/Llama2-for-non-engineers,"Thu, 28 Sep 2023 00:00:00 GMT",Hugging Face Blog,2026-05-22T10:45:41.864513
Llama 2 on Amazon SageMaker a Benchmark,,https://huggingface.co/blog/llama-sagemaker-benchmark,"Tue, 26 Sep 2023 00:00:00 GMT",Hugging Face Blog,2026-05-22T10:45:41.864519
Inference for PROs,,https://huggingface.co/blog/inference-pro,"Fri, 22 Sep 2023 00:00:00 GMT",Hugging Face Blog,2026-05-22T10:45:41.864526
Rocket Money x Hugging Face: Scaling Volatile ML Models in Production​,,https://huggingface.co/blog/rocketmoney-case-study,"Tue, 19 Sep 2023 00:00:00 GMT",Hugging Face Blog,2026-05-22T10:45:41.864533
Introduction to 3D Gaussian Splatting,,https://huggingface.co/blog/gaussian-splatting,"Mon, 18 Sep 2023 00:00:00 GMT",Hugging Face Blog,2026-05-22T10:45:41.864541
Object Detection Leaderboard,,https://huggingface.co/blog/object-detection-leaderboard,"Mon, 18 Sep 2023 00:00:00 GMT",Hugging Face Blog,2026-05-22T10:45:41.864550
Optimizing your LLM in production,,https://huggingface.co/blog/optimize-llm,"Fri, 15 Sep 2023 00:00:00 GMT",Hugging Face Blog,2026-05-22T10:45:41.864556
Introducing Würstchen: Fast Diffusion for Image Generation,,https://huggingface.co/blog/wuerstchen,"Wed, 13 Sep 2023 00:00:00 GMT",Hugging Face Blog,2026-05-22T10:45:41.864562
Fine-tuning Llama 2 70B using PyTorch FSDP,,https://huggingface.co/blog/ram-efficient-pytorch-fsdp,"Wed, 13 Sep 2023 00:00:00 GMT",Hugging Face Blog,2026-05-22T10:45:41.864569
Overview of natively supported quantization schemes in 🤗 Transformers,,https://huggingface.co/blog/overview-quantization-transformers,"Tue, 12 Sep 2023 00:00:00 GMT",Hugging Face Blog,2026-05-22T10:45:41.864575
SafeCoder vs. Closed-source Code Assistants,,https://huggingface.co/blog/safecoder-vs-closed-source-code-assistants,"Mon, 11 Sep 2023 00:00:00 GMT",Hugging Face Blog,2026-05-22T10:45:41.864582
Efficient Controllable Generation for SDXL with T2I-Adapters,,https://huggingface.co/blog/t2i-sdxl-adapters,"Fri, 08 Sep 2023 00:00:00 GMT",Hugging Face Blog,2026-05-22T10:45:41.864588
Spread Your Wings: Falcon 180B is here,,https://huggingface.co/blog/falcon-180b,"Wed, 06 Sep 2023 00:00:00 GMT",Hugging Face Blog,2026-05-22T10:45:41.864594
Fetch Cuts ML Processing Latency by 50% Using Amazon SageMaker & Hugging Face,,https://huggingface.co/blog/fetch-case-study,"Fri, 01 Sep 2023 00:00:00 GMT",Hugging Face Blog,2026-05-22T10:45:41.864601
"AudioLDM 2, but faster ⚡️",,https://huggingface.co/blog/audioldm2,"Wed, 30 Aug 2023 00:00:00 GMT",Hugging Face Blog,2026-05-22T10:45:41.864607
Code Llama: Llama 2 learns to code,,https://huggingface.co/blog/codellama,"Fri, 25 Aug 2023 00:00:00 GMT",Hugging Face Blog,2026-05-22T10:45:41.864613
Deprecation of Git Authentication using password,,https://huggingface.co/blog/password-git-deprecation,"Fri, 25 Aug 2023 00:00:00 GMT",Hugging Face Blog,2026-05-22T10:45:41.864620
Making LLMs lighter with AutoGPTQ and transformers,,https://huggingface.co/blog/gptq-integration,"Wed, 23 Aug 2023 00:00:00 GMT",Hugging Face Blog,2026-05-22T10:45:41.864626
Introducing SafeCoder,,https://huggingface.co/blog/safecoder,"Tue, 22 Aug 2023 00:00:00 GMT",Hugging Face Blog,2026-05-22T10:45:41.864632
Introducing IDEFICS: An Open Reproduction of State-of-the-art Visual Langage Model,,https://huggingface.co/blog/idefics,"Tue, 22 Aug 2023 00:00:00 GMT",Hugging Face Blog,2026-05-22T10:45:41.864640
Hugging Face Hub on the AWS Marketplace: Pay with your AWS Account,,https://huggingface.co/blog/aws-marketplace,"Thu, 10 Aug 2023 00:00:00 GMT",Hugging Face Blog,2026-05-22T10:45:41.864646
Optimizing Bark using 🤗 Transformers,,https://huggingface.co/blog/optimizing-bark,"Wed, 09 Aug 2023 00:00:00 GMT",Hugging Face Blog,2026-05-22T10:45:41.864652
Deploying Hugging Face Models with BentoML: DeepFloyd IF in Action,,https://huggingface.co/blog/deploy-deepfloydif-using-bentoml,"Wed, 09 Aug 2023 00:00:00 GMT",Hugging Face Blog,2026-05-22T10:45:41.864659
Fine-tune Llama 2 with DPO,,https://huggingface.co/blog/dpo-trl,"Tue, 08 Aug 2023 00:00:00 GMT",Hugging Face Blog,2026-05-22T10:45:41.864665
Releasing Swift Transformers: Run On-Device LLMs in Apple Devices,,https://huggingface.co/blog/swift-coreml-llm,"Tue, 08 Aug 2023 00:00:00 GMT",Hugging Face Blog,2026-05-22T10:45:41.864671
Deploy MusicGen in no time with Inference Endpoints,,https://huggingface.co/blog/run-musicgen-as-an-api,"Fri, 04 Aug 2023 00:00:00 GMT",Hugging Face Blog,2026-05-22T10:45:41.864678
Huggy Lingo: Using Machine Learning to Improve Language Metadata on the Hugging Face Hub,,https://huggingface.co/blog/huggy-lingo,"Wed, 02 Aug 2023 00:00:00 GMT",Hugging Face Blog,2026-05-22T10:45:41.864684
Towards Encrypted Large Language Models with FHE,,https://huggingface.co/blog/encrypted-llm,"Wed, 02 Aug 2023 00:00:00 GMT",Hugging Face Blog,2026-05-22T10:45:41.864690
Practical 3D Asset Generation: A Step-by-Step Guide,,https://huggingface.co/blog/3d-assets,"Tue, 01 Aug 2023 00:00:00 GMT",Hugging Face Blog,2026-05-22T10:45:41.864696
Open-sourcing Knowledge Distillation Code and Weights of SD-Small and SD-Tiny,,https://huggingface.co/blog/sd_distillation,"Tue, 01 Aug 2023 00:00:00 GMT",Hugging Face Blog,2026-05-22T10:45:41.864703
Stable Diffusion XL on Mac with Advanced Core ML Quantization,,https://huggingface.co/blog/stable-diffusion-xl-coreml,"Thu, 27 Jul 2023 00:00:00 GMT",Hugging Face Blog,2026-05-22T10:45:41.864709
AI Policy @🤗: Open ML Considerations in the EU AI Act,,https://huggingface.co/blog/eu-ai-act-oss,"Mon, 24 Jul 2023 00:00:00 GMT",Hugging Face Blog,2026-05-22T10:45:41.864715
Introducing Agents.js: Give tools to your LLMs using JavaScript,,https://huggingface.co/blog/agents-js,"Mon, 24 Jul 2023 00:00:00 GMT",Hugging Face Blog,2026-05-22T10:45:41.864724
Results of the Open Source AI Game Jam,,https://huggingface.co/blog/game-jam-first-edition-results,"Fri, 21 Jul 2023 00:00:00 GMT",Hugging Face Blog,2026-05-22T10:45:41.864730
Happy 1st anniversary 🤗 Diffusers!,,https://huggingface.co/blog/diffusers-turns-1,"Thu, 20 Jul 2023 00:00:00 GMT",Hugging Face Blog,2026-05-22T10:45:41.864737
Llama 2 is here - get it on Hugging Face,,https://huggingface.co/blog/llama2,"Tue, 18 Jul 2023 00:00:00 GMT",Hugging Face Blog,2026-05-22T10:45:41.864742
Building an AI WebTV,,https://huggingface.co/blog/ai-webtv,"Mon, 17 Jul 2023 00:00:00 GMT",Hugging Face Blog,2026-05-22T10:45:41.864749
Open-Source Text Generation & LLM Ecosystem at Hugging Face,,https://huggingface.co/blog/os-llms,"Mon, 17 Jul 2023 00:00:00 GMT",Hugging Face Blog,2026-05-22T10:45:41.864755
Fine-tuning Stable Diffusion models on Intel CPUs,,https://huggingface.co/blog/stable-diffusion-finetuning-intel,"Fri, 14 Jul 2023 00:00:00 GMT",Hugging Face Blog,2026-05-22T10:45:41.864762
Making ML-powered web games with Transformers.js,,https://huggingface.co/blog/ml-web-games,"Wed, 05 Jul 2023 00:00:00 GMT",Hugging Face Blog,2026-05-22T10:45:41.864768
Deploy LLMs with Hugging Face Inference Endpoints,,https://huggingface.co/blog/inference-endpoints-llm,"Tue, 04 Jul 2023 00:00:00 GMT",Hugging Face Blog,2026-05-22T10:45:41.864775
Making a web app generator with open ML models,,https://huggingface.co/blog/text-to-webapp,"Mon, 03 Jul 2023 00:00:00 GMT",Hugging Face Blog,2026-05-22T10:45:41.864781
Leveraging Hugging Face for complex generative AI use cases,,https://huggingface.co/blog/writer-case-study,"Sat, 01 Jul 2023 00:00:00 GMT",Hugging Face Blog,2026-05-22T10:45:41.864787
Accelerating Vision-Language Models: BridgeTower on Habana Gaudi2,,https://huggingface.co/blog/bridgetower,"Thu, 29 Jun 2023 00:00:00 GMT",Hugging Face Blog,2026-05-22T10:45:41.864794
Ethics and Society Newsletter #4: Bias in Text-to-Image Models,,https://huggingface.co/blog/ethics-soc-4,"Mon, 26 Jun 2023 00:00:00 GMT",Hugging Face Blog,2026-05-22T10:45:41.864800
What's going on with the Open LLM Leaderboard?,,https://huggingface.co/blog/open-llm-leaderboard-mmlu,"Fri, 23 Jun 2023 00:00:00 GMT",Hugging Face Blog,2026-05-22T10:45:41.864809
Panel on Hugging Face,,https://huggingface.co/blog/panel-on-hugging-face,"Thu, 22 Jun 2023 00:00:00 GMT",Hugging Face Blog,2026-05-22T10:45:41.864815
AI Policy @🤗: Response to the U.S. NTIA's Request for Comment on AI Accountability,,https://huggingface.co/blog/policy-ntia-rfc,"Tue, 20 Jun 2023 00:00:00 GMT",Hugging Face Blog,2026-05-22T10:45:41.864822
Fine-Tune MMS Adapter Models for low-resource ASR,,https://huggingface.co/blog/mms_adapters,"Mon, 19 Jun 2023 00:00:00 GMT",Hugging Face Blog,2026-05-22T10:45:41.864828
"Yes, Transformers are Effective for Time Series Forecasting (+ Autoformer)",,https://huggingface.co/blog/autoformer,"Fri, 16 Jun 2023 00:00:00 GMT",Hugging Face Blog,2026-05-22T10:45:41.864834
"Faster Stable Diffusion with Core ML on iPhone, iPad, and Mac",,https://huggingface.co/blog/fast-diffusers-coreml,"Thu, 15 Jun 2023 00:00:00 GMT",Hugging Face Blog,2026-05-22T10:45:41.864843
Deploy Livebook notebooks as apps to Hugging Face Spaces,,https://huggingface.co/blog/livebook-app-deployment,"Thu, 15 Jun 2023 00:00:00 GMT",Hugging Face Blog,2026-05-22T10:45:41.864849
Announcing our new Content Guidelines and Policy,,https://huggingface.co/blog/content-guidelines-update,"Thu, 15 Jun 2023 00:00:00 GMT",Hugging Face Blog,2026-05-22T10:45:41.864856
Hugging Face and AMD partner on accelerating state-of-the-art models for CPU and GPU platforms,,https://huggingface.co/blog/huggingface-and-amd,"Tue, 13 Jun 2023 00:00:00 GMT",Hugging Face Blog,2026-05-22T10:45:41.864862
Can foundation models label data like humans?,,https://huggingface.co/blog/open-llm-leaderboard-rlhf,"Mon, 12 Jun 2023 00:00:00 GMT",Hugging Face Blog,2026-05-22T10:45:41.864868
"The Hugging Face Hub for Galleries, Libraries, Archives and Museums",,https://huggingface.co/blog/hf-hub-glam-guide,"Mon, 12 Jun 2023 00:00:00 GMT",Hugging Face Blog,2026-05-22T10:45:41.864874
"DuckDB: analyze 50,000+ datasets stored on the Hugging Face Hub",,https://huggingface.co/blog/hub-duckdb,"Wed, 07 Jun 2023 00:00:00 GMT",Hugging Face Blog,2026-05-22T10:45:41.864880
Welcome fastText to the Hugging Face Hub,,https://huggingface.co/blog/fasttext,"Tue, 06 Jun 2023 00:00:00 GMT",Hugging Face Blog,2026-05-22T10:45:41.864886
The Falcon has landed in the Hugging Face ecosystem,,https://huggingface.co/blog/falcon,"Mon, 05 Jun 2023 00:00:00 GMT",Hugging Face Blog,2026-05-22T10:45:41.864895
AI Speech Recognition in Unity,,https://huggingface.co/blog/unity-asr,"Fri, 02 Jun 2023 00:00:00 GMT",Hugging Face Blog,2026-05-22T10:45:41.864901
Announcing the Open Source AI Game Jam 🎮,,https://huggingface.co/blog/game-jam,"Thu, 01 Jun 2023 00:00:00 GMT",Hugging Face Blog,2026-05-22T10:45:41.864907
Introducing the Hugging Face LLM Inference Container for Amazon SageMaker,,https://huggingface.co/blog/sagemaker-huggingface-llm,"Wed, 31 May 2023 00:00:00 GMT",Hugging Face Blog,2026-05-22T10:45:41.864913
Introducing BERTopic Integration with the Hugging Face Hub,,https://huggingface.co/blog/bertopic,"Wed, 31 May 2023 00:00:00 GMT",Hugging Face Blog,2026-05-22T10:45:41.864919
Optimizing Stable Diffusion for Intel CPUs with NNCF and 🤗 Optimum,,https://huggingface.co/blog/train-optimize-sd-intel,"Thu, 25 May 2023 00:00:00 GMT",Hugging Face Blog,2026-05-22T10:45:41.864926
"Making LLMs even more accessible with bitsandbytes, 4-bit quantization and QLoRA",,https://huggingface.co/blog/4bit-transformers-bitsandbytes,"Wed, 24 May 2023 00:00:00 GMT",Hugging Face Blog,2026-05-22T10:45:41.864932
Hugging Face Collaborates with Microsoft to launch Hugging Face Model Catalog on Azure,,https://huggingface.co/blog/hugging-face-endpoints-on-azure,"Wed, 24 May 2023 00:00:00 GMT",Hugging Face Blog,2026-05-22T10:45:41.864938
"Hugging Face and IBM partner on watsonx.ai, the next-generation enterprise studio for AI builders",,https://huggingface.co/blog/huggingface-and-ibm,"Tue, 23 May 2023 00:00:00 GMT",Hugging Face Blog,2026-05-22T10:45:41.864944
🐶Safetensors audited as really safe and becoming the default,,https://huggingface.co/blog/safetensors-security-audit,"Tue, 23 May 2023 00:00:00 GMT",Hugging Face Blog,2026-05-22T10:45:41.864950
Instruction-tuning Stable Diffusion with InstructPix2Pix,,https://huggingface.co/blog/instruction-tuning-sd,"Tue, 23 May 2023 00:00:00 GMT",Hugging Face Blog,2026-05-22T10:45:41.864956
Large-scale Near-deduplication Behind BigCode,,https://huggingface.co/blog/dedup,"Tue, 16 May 2023 00:00:00 GMT",Hugging Face Blog,2026-05-22T10:45:41.864962
"Smaller is better: Q8-Chat, an efficient generative AI experience on Xeon",,https://huggingface.co/blog/generative-ai-models-on-intel-cpu,"Tue, 16 May 2023 00:00:00 GMT",Hugging Face Blog,2026-05-22T10:45:41.864968
Hugging Face Selected for the French Data Protection Agency Enhanced Support Program,,https://huggingface.co/blog/cnil,"Mon, 15 May 2023 00:00:00 GMT",Hugging Face Blog,2026-05-22T10:45:41.864974
Run a Chatgpt-like Chatbot on a Single GPU with ROCm,,https://huggingface.co/blog/chatbot-amd-gpu,"Mon, 15 May 2023 00:00:00 GMT",Hugging Face Blog,2026-05-22T10:45:41.864983
Introducing RWKV - An RNN with the advantages of a transformer,,https://huggingface.co/blog/rwkv,"Mon, 15 May 2023 00:00:00 GMT",Hugging Face Blog,2026-05-22T10:45:41.864989
Assisted Generation: a new direction toward low-latency text generation,,https://huggingface.co/blog/assisted-generation,"Thu, 11 May 2023 00:00:00 GMT",Hugging Face Blog,2026-05-22T10:45:41.864995
Creating a Coding Assistant with StarCoder,,https://huggingface.co/blog/starchat-alpha,"Tue, 09 May 2023 00:00:00 GMT",Hugging Face Blog,2026-05-22T10:45:41.865002
A Dive into Text-to-Video Models,,https://huggingface.co/blog/text-to-video,"Mon, 08 May 2023 00:00:00 GMT",Hugging Face Blog,2026-05-22T10:45:41.865010
StarCoder: A State-of-the-Art LLM for Code,,https://huggingface.co/blog/starcoder,"Thu, 04 May 2023 00:00:00 GMT",Hugging Face Blog,2026-05-22T10:45:41.865016
How to Install and Use the Hugging Face Unity API,,https://huggingface.co/blog/unity-api,"Mon, 01 May 2023 00:00:00 GMT",Hugging Face Blog,2026-05-22T10:45:41.865023
Training a language model with 🤗 Transformers using TensorFlow and TPUs,,https://huggingface.co/blog/tf_tpu,"Thu, 27 Apr 2023 00:00:00 GMT",Hugging Face Blog,2026-05-22T10:45:41.865029
Running IF with 🧨 diffusers on a Free Tier Google Colab,,https://huggingface.co/blog/if,"Wed, 26 Apr 2023 00:00:00 GMT",Hugging Face Blog,2026-05-22T10:45:41.865035
Databricks ❤️ Hugging Face: up to 40% faster training and tuning of Large Language Models,,https://huggingface.co/blog/databricks-case-study,"Wed, 26 Apr 2023 00:00:00 GMT",Hugging Face Blog,2026-05-22T10:45:41.865041
Introducing HuggingFace blog for Chinese speakers: Fostering Collaboration with the Chinese AI community,,https://huggingface.co/blog/chinese-language-blog,"Mon, 24 Apr 2023 00:00:00 GMT",Hugging Face Blog,2026-05-22T10:45:41.865048
How to host a Unity game in a Space,,https://huggingface.co/blog/unity-in-spaces,"Fri, 21 Apr 2023 00:00:00 GMT",Hugging Face Blog,2026-05-22T10:45:41.865054
Accelerating Hugging Face Transformers with AWS Inferentia2,,https://huggingface.co/blog/accelerate-transformers-with-inferentia2,"Mon, 17 Apr 2023 00:00:00 GMT",Hugging Face Blog,2026-05-22T10:45:41.865060
Graph Classification with Transformers,,https://huggingface.co/blog/graphml-classification,"Fri, 14 Apr 2023 00:00:00 GMT",Hugging Face Blog,2026-05-22T10:45:41.865068
Creating Privacy Preserving AI with Substra,,https://huggingface.co/blog/owkin-substra,"Wed, 12 Apr 2023 00:00:00 GMT",Hugging Face Blog,2026-05-22T10:45:41.865075
Snorkel AI x Hugging Face: unlock foundation models for enterprises,,https://huggingface.co/blog/snorkel-case-study,"Thu, 06 Apr 2023 00:00:00 GMT",Hugging Face Blog,2026-05-22T10:45:41.865081
StackLLaMA: A hands-on guide to train LLaMA with RLHF,,https://huggingface.co/blog/stackllama,"Wed, 05 Apr 2023 00:00:00 GMT",Hugging Face Blog,2026-05-22T10:45:41.865088
Ethics and Society Newsletter #3: Ethical Openness at Hugging Face,,https://huggingface.co/blog/ethics-soc-3,"Thu, 30 Mar 2023 00:00:00 GMT",Hugging Face Blog,2026-05-22T10:45:41.865094
Fast Inference on Large Language Models: BLOOMZ on Habana Gaudi2 Accelerator,,https://huggingface.co/blog/habana-gaudi-2-bloom,"Tue, 28 Mar 2023 00:00:00 GMT",Hugging Face Blog,2026-05-22T10:45:41.865100
Accelerating Stable Diffusion Inference on Intel CPUs,,https://huggingface.co/blog/stable-diffusion-inference-intel,"Tue, 28 Mar 2023 00:00:00 GMT",Hugging Face Blog,2026-05-22T10:45:41.865106
Federated Learning using Hugging Face and Flower,,https://huggingface.co/blog/fl-with-flower,"Mon, 27 Mar 2023 00:00:00 GMT",Hugging Face Blog,2026-05-22T10:45:41.865113
Train your ControlNet with diffusers,,https://huggingface.co/blog/train-your-controlnet,"Fri, 24 Mar 2023 00:00:00 GMT",Hugging Face Blog,2026-05-22T10:45:41.865119
Jupyter X Hugging Face,,https://huggingface.co/blog/notebooks-hub,"Thu, 23 Mar 2023 00:00:00 GMT",Hugging Face Blog,2026-05-22T10:45:41.865125
Multivariate Probabilistic Time Series Forecasting with Informer,,https://huggingface.co/blog/informer,"Fri, 10 Mar 2023 00:00:00 GMT",Hugging Face Blog,2026-05-22T10:45:41.865131
Fine-tuning 20B LLMs with RLHF on a 24GB consumer GPU,,https://huggingface.co/blog/trl-peft,"Thu, 09 Mar 2023 00:00:00 GMT",Hugging Face Blog,2026-05-22T10:45:41.865138
New ViT and ALIGN Models From Kakao Brain,,https://huggingface.co/blog/vit-align,"Mon, 06 Mar 2023 00:00:00 GMT",Hugging Face Blog,2026-05-22T10:45:41.865144
Using Machine Learning to Aid Survivors and Race through Time,,https://huggingface.co/blog/using-ml-for-disasters,"Fri, 03 Mar 2023 00:00:00 GMT",Hugging Face Blog,2026-05-22T10:45:41.865152
ControlNet in 🧨 Diffusers,,https://huggingface.co/blog/controlnet,"Fri, 03 Mar 2023 00:00:00 GMT",Hugging Face Blog,2026-05-22T10:45:41.865159
Ethical Guidelines for developing the Diffusers library,,https://huggingface.co/blog/ethics-diffusers,"Thu, 02 Mar 2023 00:00:00 GMT",Hugging Face Blog,2026-05-22T10:45:41.865165
How Hugging Face Accelerated Development of Witty Works Writing Assistant,,https://huggingface.co/blog/classification-use-cases,"Wed, 01 Mar 2023 00:00:00 GMT",Hugging Face Blog,2026-05-22T10:45:41.865177
Red-Teaming Large Language Models,,https://huggingface.co/blog/red-teaming,"Fri, 24 Feb 2023 00:00:00 GMT",Hugging Face Blog,2026-05-22T10:45:41.865183
Swift 🧨Diffusers - Fast Stable Diffusion for Mac,,https://huggingface.co/blog/fast-mac-diffusers,"Fri, 24 Feb 2023 00:00:00 GMT",Hugging Face Blog,2026-05-22T10:45:41.865190
Fetch Consolidates AI Tools and Saves 30% Development Time with Hugging Face on AWS,,https://huggingface.co/blog/fetch-eap-case-study,"Thu, 23 Feb 2023 00:00:00 GMT",Hugging Face Blog,2026-05-22T10:45:41.865196
Hugging Face and AWS partner to make AI more accessible,,https://huggingface.co/blog/aws-partnership,"Tue, 21 Feb 2023 00:00:00 GMT",Hugging Face Blog,2026-05-22T10:45:41.865202
Zero-shot image-to-text generation with BLIP-2,,https://huggingface.co/blog/blip-2,"Wed, 15 Feb 2023 00:00:00 GMT",Hugging Face Blog,2026-05-22T10:45:41.865208
"Why we’re switching to Hugging Face Inference Endpoints, and maybe you should too",,https://huggingface.co/blog/mantis-case-study,"Wed, 15 Feb 2023 00:00:00 GMT",Hugging Face Blog,2026-05-22T10:45:41.865215
Parameter-Efficient Fine-Tuning using 🤗 PEFT,,https://huggingface.co/blog/peft,"Fri, 10 Feb 2023 00:00:00 GMT",Hugging Face Blog,2026-05-22T10:45:41.865221
"Speech Synthesis, Recognition, and More With SpeechT5",,https://huggingface.co/blog/speecht5,"Wed, 08 Feb 2023 00:00:00 GMT",Hugging Face Blog,2026-05-22T10:45:41.865227
Generating Stories: AI for Game Development #5,,https://huggingface.co/blog/ml-for-games-5,"Tue, 07 Feb 2023 00:00:00 GMT",Hugging Face Blog,2026-05-22T10:45:41.865233
Introducing ⚔️ AI vs. AI ⚔️ a deep reinforcement learning multi-agents competition system,,https://huggingface.co/blog/aivsai,"Tue, 07 Feb 2023 00:00:00 GMT",Hugging Face Blog,2026-05-22T10:45:41.865252
Accelerating PyTorch Transformers with Intel Sapphire Rapids - part 2,,https://huggingface.co/blog/intel-sapphire-rapids-inference,"Mon, 06 Feb 2023 00:00:00 GMT",Hugging Face Blog,2026-05-22T10:45:41.865259
A Dive into Vision-Language Models,,https://huggingface.co/blog/vision_language_pretraining,"Fri, 03 Feb 2023 00:00:00 GMT",Hugging Face Blog,2026-05-22T10:45:41.865265
The State of Computer Vision at Hugging Face 🤗,,https://huggingface.co/blog/cv_state,"Mon, 30 Jan 2023 00:00:00 GMT",Hugging Face Blog,2026-05-22T10:45:41.865271
2D Asset Generation: AI for Game Development #4,,https://huggingface.co/blog/ml-for-games-4,"Thu, 26 Jan 2023 00:00:00 GMT",Hugging Face Blog,2026-05-22T10:45:41.865277
Using LoRA for Efficient Stable Diffusion Fine-Tuning,,https://huggingface.co/blog/lora,"Thu, 26 Jan 2023 00:00:00 GMT",Hugging Face Blog,2026-05-22T10:45:41.865284
What Makes a Dialog Agent Useful?,,https://huggingface.co/blog/dialog-agents,"Tue, 24 Jan 2023 00:00:00 GMT",Hugging Face Blog,2026-05-22T10:45:41.865290
"Optimum+ONNX Runtime - Easier, Faster training for your Hugging Face models",,https://huggingface.co/blog/optimum-onnxruntime-training,"Tue, 24 Jan 2023 00:00:00 GMT",Hugging Face Blog,2026-05-22T10:45:41.865297
3D Asset Generation: AI for Game Development #3,,https://huggingface.co/blog/ml-for-games-3,"Fri, 20 Jan 2023 00:00:00 GMT",Hugging Face Blog,2026-05-22T10:45:41.865303
Universal Image Segmentation with Mask2Former and OneFormer,,https://huggingface.co/blog/mask2former,"Thu, 19 Jan 2023 00:00:00 GMT",Hugging Face Blog,2026-05-22T10:45:41.865309
Welcome PaddlePaddle to the Hugging Face Hub,,https://huggingface.co/blog/paddlepaddle,"Tue, 17 Jan 2023 00:00:00 GMT",Hugging Face Blog,2026-05-22T10:45:41.865315
Image Similarity with Hugging Face Datasets and Transformers,,https://huggingface.co/blog/image-similarity,"Mon, 16 Jan 2023 00:00:00 GMT",Hugging Face Blog,2026-05-22T10:45:41.865321
AI for Game Development: Creating a Farming Game in 5 Days. Part 2,,https://huggingface.co/blog/ml-for-games-2,"Mon, 09 Jan 2023 00:00:00 GMT",Hugging Face Blog,2026-05-22T10:45:41.865328
Introduction to Graph Machine Learning,,https://huggingface.co/blog/intro-graphml,"Tue, 03 Jan 2023 00:00:00 GMT",Hugging Face Blog,2026-05-22T10:45:41.865334
AI for Game Development: Creating a Farming Game in 5 Days. Part 1,,https://huggingface.co/blog/ml-for-games-1,"Mon, 02 Jan 2023 00:00:00 GMT",Hugging Face Blog,2026-05-22T10:45:41.865343
Accelerating PyTorch Transformers with Intel Sapphire Rapids - part 1,,https://huggingface.co/blog/intel-sapphire-rapids,"Mon, 02 Jan 2023 00:00:00 GMT",Hugging Face Blog,2026-05-22T10:45:41.865349
Zero-shot image segmentation with CLIPSeg,,https://huggingface.co/blog/clipseg-zero-shot,"Wed, 21 Dec 2022 00:00:00 GMT",Hugging Face Blog,2026-05-22T10:45:41.865355
Model Cards,,https://huggingface.co/blog/model-cards,"Tue, 20 Dec 2022 00:00:00 GMT",Hugging Face Blog,2026-05-22T10:45:41.865362
Let's talk about biases in machine learning! Ethics and Society Newsletter #2,,https://huggingface.co/blog/ethics-soc-2,"Thu, 15 Dec 2022 00:00:00 GMT",Hugging Face Blog,2026-05-22T10:45:41.865368
A Complete Guide to Audio Datasets,,https://huggingface.co/blog/audio-datasets,"Thu, 15 Dec 2022 00:00:00 GMT",Hugging Face Blog,2026-05-22T10:45:41.865374
Faster Training and Inference: Habana Gaudi®2 vs Nvidia A100 80GB,,https://huggingface.co/blog/habana-gaudi-2-benchmark,"Wed, 14 Dec 2022 00:00:00 GMT",Hugging Face Blog,2026-05-22T10:45:41.865380
Illustrating Reinforcement Learning from Human Feedback (RLHF),,https://huggingface.co/blog/rlhf,"Fri, 09 Dec 2022 00:00:00 GMT",Hugging Face Blog,2026-05-22T10:45:41.865387
From GPT2 to Stable Diffusion: Hugging Face arrives to the Elixir community,,https://huggingface.co/blog/elixir-bumblebee,"Fri, 09 Dec 2022 00:00:00 GMT",Hugging Face Blog,2026-05-22T10:45:41.865393
Deep Learning with Proteins,,https://huggingface.co/blog/deep-learning-with-proteins,"Fri, 02 Dec 2022 00:00:00 GMT",Hugging Face Blog,2026-05-22T10:45:41.865399
Using Stable Diffusion with Core ML on Apple Silicon,,https://huggingface.co/blog/diffusers-coreml,"Thu, 01 Dec 2022 00:00:00 GMT",Hugging Face Blog,2026-05-22T10:45:41.865405
Probabilistic Time Series Forecasting with 🤗 Transformers,,https://huggingface.co/blog/time-series-transformers,"Thu, 01 Dec 2022 00:00:00 GMT",Hugging Face Blog,2026-05-22T10:45:41.865411
VQ-Diffusion,,https://huggingface.co/blog/vq-diffusion,"Wed, 30 Nov 2022 00:00:00 GMT",Hugging Face Blog,2026-05-22T10:45:41.865417
We are hiring interns!,,https://huggingface.co/blog/interns-2023,"Tue, 29 Nov 2022 00:00:00 GMT",Hugging Face Blog,2026-05-22T10:45:41.865426
Diffusion Models Live Event,,https://huggingface.co/blog/diffusion-models-event,"Fri, 25 Nov 2022 00:00:00 GMT",Hugging Face Blog,2026-05-22T10:45:41.865432
Director of Machine Learning Insights [Part 4],,https://huggingface.co/blog/ml-director-insights-4,"Wed, 23 Nov 2022 00:00:00 GMT",Hugging Face Blog,2026-05-22T10:45:41.865438
Accelerating Document AI,,https://huggingface.co/blog/document-ai,"Mon, 21 Nov 2022 00:00:00 GMT",Hugging Face Blog,2026-05-22T10:45:41.865444
An overview of inference solutions on Hugging Face,,https://huggingface.co/blog/inference-update,"Mon, 21 Nov 2022 00:00:00 GMT",Hugging Face Blog,2026-05-22T10:45:41.865450
Hugging Face Machine Learning Demos on arXiv,,https://huggingface.co/blog/arxiv,"Thu, 17 Nov 2022 00:00:00 GMT",Hugging Face Blog,2026-05-22T10:45:41.865456
