title,summary,link,published,source,collected_at
Transformer-based Encoder-Decoder Models,,https://huggingface.co/blog/encoder-decoder,"Sat, 10 Oct 2020 00:00:00 GMT",Hugging Face Blog,2026-05-22T10:45:41.866417
Block Sparse Matrices for Smaller and Faster Language Models,,https://huggingface.co/blog/pytorch_block_sparse,"Thu, 10 Sep 2020 00:00:00 GMT",Hugging Face Blog,2026-05-22T10:45:41.866423
The Reformer - Pushing the limits of language modeling,,https://huggingface.co/blog/reformer,"Fri, 03 Jul 2020 00:00:00 GMT",Hugging Face Blog,2026-05-22T10:45:41.866430
How to generate text: using different decoding methods for language generation with Transformers,,https://huggingface.co/blog/how-to-generate,"Sun, 01 Mar 2020 00:00:00 GMT",Hugging Face Blog,2026-05-22T10:45:41.866436
How to train a new language model from scratch using Transformers and Tokenizers,,https://huggingface.co/blog/how-to-train,"Fri, 14 Feb 2020 00:00:00 GMT",Hugging Face Blog,2026-05-22T10:45:41.866442
Active Learning,,https://lilianweng.github.io/lil-log/2022/02/20/active-learning.html,2022-02-20T00:00:00+00:00,Lil'Log (Lilian Weng),2026-05-22T10:45:42.377425
Semi Supervised Learning,,https://lilianweng.github.io/lil-log/2021/12/05/semi-supervised-learning.html,2021-12-05T00:00:00+00:00,Lil'Log (Lilian Weng),2026-05-22T10:45:42.377439
Train Large Neural Networks,,https://lilianweng.github.io/lil-log/2021/09/25/train-large-neural-networks.html,2021-09-25T00:00:00+00:00,Lil'Log (Lilian Weng),2026-05-22T10:45:42.377443
Diffusion Models,,https://lilianweng.github.io/lil-log/2021/07/11/diffusion-models.html,2021-07-11T00:00:00+00:00,Lil'Log (Lilian Weng),2026-05-22T10:45:42.377448
Contrastive Representation Learning,,https://lilianweng.github.io/lil-log/2021/05/31/contrastive-representation-learning.html,2021-05-31T00:00:00+00:00,Lil'Log (Lilian Weng),2026-05-22T10:45:42.377452
Reducing Toxicity In Language Models,,https://lilianweng.github.io/lil-log/2021/03/21/reducing-toxicity-in-language-models.html,2021-03-21T00:00:00+00:00,Lil'Log (Lilian Weng),2026-05-22T10:45:42.377456
Controllable Neural Text Generation,,https://lilianweng.github.io/lil-log/2021/01/02/controllable-neural-text-generation.html,2021-01-02T00:00:00+00:00,Lil'Log (Lilian Weng),2026-05-22T10:45:42.377460
Open Domain Question Answering,,https://lilianweng.github.io/lil-log/2020/10/29/open-domain-question-answering.html,2020-10-29T00:00:00+00:00,Lil'Log (Lilian Weng),2026-05-22T10:45:42.377464
Neural Architecture Search,,https://lilianweng.github.io/lil-log/2020/08/06/neural-architecture-search.html,2020-08-06T00:00:00+00:00,Lil'Log (Lilian Weng),2026-05-22T10:45:42.377468
Exploration Strategies In Deep Reinforcement Learning,,https://lilianweng.github.io/lil-log/2020/06/07/exploration-strategies-in-deep-reinforcement-learning.html,2020-06-07T00:00:00+00:00,Lil'Log (Lilian Weng),2026-05-22T10:45:42.377473
Reel Friends: Building Social Discovery that Scales to Billions,"<p>On its face the new Friend Bubbles feature looks simple enough. It highlights Reels your friends have watched and reacted to. But sometimes the features that seem the most straightforward require the deepest engineering work. On this episode of the Meta Tech Podcast, Pascal Hartig chats with Subasree and Joseph, two software engineers from the Facebook [...]</p>
<p><a class=""btn btn-secondary understrap-read-more-link"" href=""https://engineering.fb.com/2026/05/13/ml-applications/reel-friends-building-social-discovery-that-scales-to-billions/"">Read More...</a></p>
<p>The post <a href=""https://engineering.fb.com/2026/05/13/ml-applications/reel-friends-building-social-discovery-that-scales-to-billions/"">Reel Friends: Building Social Discovery that Scales to Billions</a> appeared first on <a href=""https://engineering.fb.com"">Engineering at Meta</a>.</p>",https://engineering.fb.com/2026/05/13/ml-applications/reel-friends-building-social-discovery-that-scales-to-billions/,"Wed, 13 May 2026 13:00:44 +0000",Meta Engineering,2026-05-22T10:45:42.538196
Migrating Data Ingestion Systems at Meta Scale,"<p>Meta’s data ingestion system, which our engineering teams leverage for up-to-date snapshots of the social graph, has recently undergone a significant revamp to enhance its reliability at scale.  Moving from our legacy system to our new architecture required a large-scale migration of our entire data ingestion system.  We’re sharing the solutions and strategies that enabled [...]</p>
<p><a class=""btn btn-secondary understrap-read-more-link"" href=""https://engineering.fb.com/2026/05/12/data-infrastructure/migrating-data-ingestion-systems-at-meta-scale/"">Read More...</a></p>
<p>The post <a href=""https://engineering.fb.com/2026/05/12/data-infrastructure/migrating-data-ingestion-systems-at-meta-scale/"">Migrating Data Ingestion Systems at Meta Scale</a> appeared first on <a href=""https://engineering.fb.com"">Engineering at Meta</a>.</p>",https://engineering.fb.com/2026/05/12/data-infrastructure/migrating-data-ingestion-systems-at-meta-scale/,"Tue, 12 May 2026 16:00:57 +0000",Meta Engineering,2026-05-22T10:45:42.538210
Labyrinth 1.1: Making End-to-End Encrypted Backups Even More Reliable,"<p>We’re rolling out version 1.1 of Labyrinth, the encrypted storage system and protocol that secures messages and history on Messenger. Labyrinth 1.1 enhances the reliability of end-to-end encrypted backups with a new sub-protocol that helps messages survive the loss of a device, a switched device, and long gaps between sign-ins. Read our updated white paper, [...]</p>
<p><a class=""btn btn-secondary understrap-read-more-link"" href=""https://engineering.fb.com/2026/05/11/security/labyrinth-1-1-end-to-end-encrypted-e2ee-backups-more-reliable/"">Read More...</a></p>
<p>The post <a href=""https://engineering.fb.com/2026/05/11/security/labyrinth-1-1-end-to-end-encrypted-e2ee-backups-more-reliable/"">Labyrinth 1.1: Making End-to-End Encrypted Backups Even More Reliable </a> appeared first on <a href=""https://engineering.fb.com"">Engineering at Meta</a>.</p>",https://engineering.fb.com/2026/05/11/security/labyrinth-1-1-end-to-end-encrypted-e2ee-backups-more-reliable/,"Mon, 11 May 2026 16:00:55 +0000",Meta Engineering,2026-05-22T10:45:42.538218
How Meta Is Strengthening End-to-End Encrypted Backups,"<p>The HSM-based Backup Key Vault Meta&#8217;s HSM-based Backup Key Vault provides the foundation for end-to-end encrypted backups for WhatsApp and Messenger. The system allows people to protect their backed-up message history with a recovery code, ensuring that the recovery code is stored in tamper-resistant hardware security modules (HSMs) and is inaccessible to Meta, cloud storage [...]</p>
<p><a class=""btn btn-secondary understrap-read-more-link"" href=""https://engineering.fb.com/2026/05/01/security/meta-strengthening-end-to-end-encrypted-backups/"">Read More...</a></p>
<p>The post <a href=""https://engineering.fb.com/2026/05/01/security/meta-strengthening-end-to-end-encrypted-backups/"">How Meta Is Strengthening End-to-End Encrypted Backups</a> appeared first on <a href=""https://engineering.fb.com"">Engineering at Meta</a>.</p>",https://engineering.fb.com/2026/05/01/security/meta-strengthening-end-to-end-encrypted-backups/,"Fri, 01 May 2026 16:00:58 +0000",Meta Engineering,2026-05-22T10:45:42.538224
Modernizing the Facebook Groups Search to Unlock the Power of Community Knowledge,"<p>We’ve fundamentally transformed Facebook Groups Search to help people more reliably discover, sort through, and validate community content that’s most relevant to them. We’ve adopted a new hybrid retrieval architecture and implemented automated model-based evaluation to address the major friction points people experience when searching community content. Under this new framework, we’ve made tangible improvements [...]</p>
<p><a class=""btn btn-secondary understrap-read-more-link"" href=""https://engineering.fb.com/2026/04/21/ml-applications/modernizing-the-facebook-groups-search-to-unlock-the-power-of-community-knowledge/"">Read More...</a></p>
<p>The post <a href=""https://engineering.fb.com/2026/04/21/ml-applications/modernizing-the-facebook-groups-search-to-unlock-the-power-of-community-knowledge/"">Modernizing the Facebook Groups Search to Unlock the Power of Community Knowledge</a> appeared first on <a href=""https://engineering.fb.com"">Engineering at Meta</a>.</p>",https://engineering.fb.com/2026/04/21/ml-applications/modernizing-the-facebook-groups-search-to-unlock-the-power-of-community-knowledge/,"Tue, 21 Apr 2026 16:00:19 +0000",Meta Engineering,2026-05-22T10:45:42.538230
Capacity Efficiency at Meta: How Unified AI Agents Optimize Performance at Hyperscale,"<p>We&#8217;re sharing insights into Meta&#8217;s Capacity Efficiency Program, where we&#8217;ve built an AI agent platform that helps automate finding and fixing performance issues throughout our infrastructure. By leveraging encoded domain expertise across a unified, standardized tool interface these agents help save power and free up engineers&#8217; time away from addressing performance issues to innovating on [...]</p>
<p><a class=""btn btn-secondary understrap-read-more-link"" href=""https://engineering.fb.com/2026/04/16/developer-tools/capacity-efficiency-at-meta-how-unified-ai-agents-optimize-performance-at-hyperscale/"">Read More...</a></p>
<p>The post <a href=""https://engineering.fb.com/2026/04/16/developer-tools/capacity-efficiency-at-meta-how-unified-ai-agents-optimize-performance-at-hyperscale/"">Capacity Efficiency at Meta: How Unified AI Agents Optimize Performance at Hyperscale</a> appeared first on <a href=""https://engineering.fb.com"">Engineering at Meta</a>.</p>",https://engineering.fb.com/2026/04/16/developer-tools/capacity-efficiency-at-meta-how-unified-ai-agents-optimize-performance-at-hyperscale/,"Thu, 16 Apr 2026 16:00:34 +0000",Meta Engineering,2026-05-22T10:45:42.538236
"Post-Quantum Cryptography Migration at Meta: Framework, Lessons, and Takeaways","<p>We’re sharing lessons learned from Meta’s post-quantum cryptography (PQC) migration to help other organizations strengthen their resilience as industry transitions to post-quantum cryptography standards. We’re proposing the idea of PQC Migration Levels to help teams within organizations manage the complexity of PQC migration for their various use cases. By outlining Meta’s approach to this work [...]</p>
<p><a class=""btn btn-secondary understrap-read-more-link"" href=""https://engineering.fb.com/2026/04/16/security/post-quantum-cryptography-migration-at-meta-framework-lessons-and-takeaways/"">Read More...</a></p>
<p>The post <a href=""https://engineering.fb.com/2026/04/16/security/post-quantum-cryptography-migration-at-meta-framework-lessons-and-takeaways/"">Post-Quantum Cryptography Migration at Meta: Framework, Lessons, and Takeaways</a> appeared first on <a href=""https://engineering.fb.com"">Engineering at Meta</a>.</p>",https://engineering.fb.com/2026/04/16/security/post-quantum-cryptography-migration-at-meta-framework-lessons-and-takeaways/,"Thu, 16 Apr 2026 14:59:44 +0000",Meta Engineering,2026-05-22T10:45:42.538257
Escaping the Fork: How Meta Modernized WebRTC Across 50+ Use Cases,"<p>At Meta, WebRTC powers real-time audio and video across various platforms. But forking a large open-source project like WebRTC within our monorepo presents unique challenges – over time, an internal fork can drift behind upstream, cutting itself off from community upgrades. We&#8217;re sharing how we escaped this &#8220;forking trap&#8221; &#8211; from building a dual-stack architecture [...]</p>
<p><a class=""btn btn-secondary understrap-read-more-link"" href=""https://engineering.fb.com/2026/04/09/developer-tools/escaping-the-fork-how-meta-modernized-webrtc-across-50-use-cases/"">Read More...</a></p>
<p>The post <a href=""https://engineering.fb.com/2026/04/09/developer-tools/escaping-the-fork-how-meta-modernized-webrtc-across-50-use-cases/"">Escaping the Fork: How Meta Modernized WebRTC Across 50+ Use Cases</a> appeared first on <a href=""https://engineering.fb.com"">Engineering at Meta</a>.</p>",https://engineering.fb.com/2026/04/09/developer-tools/escaping-the-fork-how-meta-modernized-webrtc-across-50-use-cases/,"Thu, 09 Apr 2026 16:00:34 +0000",Meta Engineering,2026-05-22T10:45:42.538263
Trust But Canary: Configuration Safety at Scale,"<p>As AI increases developer speed and productivity it also increases the need for safeguards. On this episode of the Meta Tech Podcast, Pascal Hartig sits down with Ishwari and Joe from Meta&#8217;s Configurations team to discuss how Meta makes config rollouts safe at scale. Listen in to learn about canarying and progressive rollouts, the health checks [...]</p>
<p><a class=""btn btn-secondary understrap-read-more-link"" href=""https://engineering.fb.com/2026/04/08/security/trust-but-canary-configuration-safety-at-scale-meta-tech-podcast/"">Read More...</a></p>
<p>The post <a href=""https://engineering.fb.com/2026/04/08/security/trust-but-canary-configuration-safety-at-scale-meta-tech-podcast/"">Trust But Canary: Configuration Safety at Scale</a> appeared first on <a href=""https://engineering.fb.com"">Engineering at Meta</a>.</p>",https://engineering.fb.com/2026/04/08/security/trust-but-canary-configuration-safety-at-scale-meta-tech-podcast/,"Wed, 08 Apr 2026 18:25:26 +0000",Meta Engineering,2026-05-22T10:45:42.538269
How generational differences affect consumer attitudes towards ads,"Our research study, in collaboration with CrowdDNA, aims to understand people's relationship with social media ads across different social media platforms.",https://research.facebook.com/blog/2023/5/how-generational-differences-affect-consumer-attitudes-towards-ads/,"Wed, 17 May 2023 10:52:00",Meta Research,2026-05-22T10:45:44.075506
Every tree counts,Meta set a goal to reach net zero emissions by 2030. We are developing technology to mitigate our carbon footprint and making these openly available.,https://research.facebook.com/blog/2023/4/every-tree-counts-large-scale-mapping-of-canopy-height-at-the-resolution-of-individual-trees/,"Mon, 17 Apr 2023 01:00:00",Meta Research,2026-05-22T10:45:44.075521
How a non-traditional background led to cutting-edge XR tech,,https://www.metacareers.com/life/how-a-non-traditional-background-led-to-cutting-edge-xr-tech,"Fri, 14 Apr 2023 01:00:00",Meta Research,2026-05-22T10:45:44.075527
"A new, unique AI dataset for animating amateur drawings",,https://ai.facebook.com/blog/ai-dataset-animation-drawings/,"Thu, 13 Apr 2023 07:00:00",Meta Research,2026-05-22T10:45:44.075534
How the metaverse can transform education,,https://about.fb.com/news/2023/04/how-the-metaverse-can-transform-education/,"Wed, 12 Apr 2023 01:00:00",Meta Research,2026-05-22T10:45:44.075540
Build faster with Buck2: Our open source build system,,https://engineering.fb.com/2023/04/06/open-source/buck2-open-source-large-scale-build-system/,"Thu, 06 Apr 2023 01:00:00",Meta Research,2026-05-22T10:45:44.075546
Announcing the 2023 Meta Research PhD Fellowship award winners,...,https://research.facebook.com/blog/2023/4/announcing-the-2023-meta-research-phd-fellowship-award-winners/,"Wed, 05 Apr 2023 09:30:00",Meta Research,2026-05-22T10:45:44.075551
Introducing Segment Anything: Working toward the first foundation model for image segmentation,,https://ai.facebook.com/blog/segment-anything-foundation-model-image-segmentation/,"Wed, 05 Apr 2023 01:00:00",Meta Research,2026-05-22T10:45:44.075557
Announcing the winners of the 2022 Foundational Integrity Research request for proposals,"In September, Meta launched the Foundational Integrity Research request for proposals. Today, we announce the winners of this award.",https://research.facebook.com/blog/2023/3/announcing-the-winners-of-the-2022-foundational-integrity-research-request-for-proposals-/,"Mon, 27 Mar 2023 04:35:00",Meta Research,2026-05-22T10:45:44.075563
Two meta sustainability grant and scholarship recipients share impact,,https://sustainability.fb.com/blog/2023/03/24/two-meta-sustainability-grant-and-scholarship-recipients-share-impact/,"Fri, 24 Mar 2023 07:00:00",Meta Research,2026-05-22T10:45:44.075569
Valve Steam Controller Review (2026): Wait for the Steam Machine,"Without the context of Valve’s Steam Machine (which is still MIA), this controller can’t fully dazzle players yet.",https://www.wired.com/review/valve-steam-controller-2026/,"Fri, 22 May 2026 10:30:00 +0000",Wired AI,2026-05-22T10:45:44.313645
Razer Viper V4 Pro Review: Iterative Update Packs Big Performance,"Small, iterative improvements bring serious performance gains to Razer’s Viper V4 Pro.",https://www.wired.com/review/review-razer-viper-v4-pro/,"Fri, 22 May 2026 09:32:00 +0000",Wired AI,2026-05-22T10:45:44.313660
"Finally, a Great Free Radio App for Windows","Tune into live broadcasts from your Windows desktop with Trdo, a free and open-source application.",https://www.wired.com/story/trdo-is-a-great-free-radio-app-for-windows/,"Fri, 22 May 2026 09:30:00 +0000",Wired AI,2026-05-22T10:45:44.313667
Nike Promo Codes and Discounts: 30% for May 2026,"Check out our deals for Nike this month, including 15% off select purchases.",https://www.wired.com/story/nike-promo-code/,"Fri, 22 May 2026 05:00:00 +0000",Wired AI,2026-05-22T10:45:44.313673
Chewy Promo Codes: $20 Off May 2026,"Explore Chewy coupon codes for $30 off, $20 off your first order $49, 50% off pet food, and more May 2026 discounts.",https://www.wired.com/story/chewy-promo-code/,"Fri, 22 May 2026 05:00:00 +0000",Wired AI,2026-05-22T10:45:44.313679
Google Workspace Promo Codes: 14% Off for May,"Boost your productivity and save with exclusive Google Workspace coupons from WIRED. Get up to 14% off plans for three months, including Starter, Standard, and Plus tiers.",https://www.wired.com/story/google-workspace-promo-code/,"Fri, 22 May 2026 05:00:00 +0000",Wired AI,2026-05-22T10:45:44.313685
Peacock Promo Codes: 40% Off May 2026,"Stream your favorite shows for up to $80 off this month, and save on subscription plans with the latest Peacock TV coupons from WIRED.",https://www.wired.com/story/peacock-promo-code/,"Fri, 22 May 2026 05:00:00 +0000",Wired AI,2026-05-22T10:45:44.313691
30% Off Samsung Promo Code | May 2026,"Save 30% or 10% with Samsung coupon codes, up to $1,000 on appliances, plus limited-time deals on the Galaxy Z Fold7, Flip7, and S25.",https://www.wired.com/story/samsung-promo-codes/,"Fri, 22 May 2026 05:00:00 +0000",Wired AI,2026-05-22T10:45:44.313696
AT&T Promo Codes: $50 Off This May 2026,"Whether you’re looking to upgrade your internet or get the latest phone, we’ve got you covered with our selection of AT&amp;T coupons and deals.",https://www.wired.com/story/att-promo-code/,"Fri, 22 May 2026 05:00:00 +0000",Wired AI,2026-05-22T10:45:44.313702
Dyson Promo Codes: 25% Off in May 2026,"Get 25% off with a Dyson coupon code, plus save up to $600 with discounts on vacuums, $150 off Airwraps, and more.",https://www.wired.com/story/dyson-cordless-vacuum-promo-code/,"Fri, 22 May 2026 05:00:00 +0000",Wired AI,2026-05-22T10:45:44.313708
What to Do in LA if You’re Here for Business (2025),"A tech industry guide to where to stay, eat, work, and play while visiting LA.",https://www.wired.com/story/los-angeles-tech-travel-guide/,"Thu, 21 May 2026 21:47:47 +0000",Wired AI,2026-05-22T10:45:44.313714
"Best Window Air Conditioners of 2026: Midea, Zafro, GE","These are the AC units we’ve trusted to cool our homes for months, if not years.",https://www.wired.com/gallery/best-window-air-conditioners/,"Thu, 21 May 2026 20:17:04 +0000",Wired AI,2026-05-22T10:45:44.313720
Mustard Made Storage Lockers Are on a Rare Sale Through May 31,"We love this brand’s stylish storage lockers, and there's a big sale on eight colors through the end of the month.",https://www.wired.com/story/mustard-made-sale/,"Thu, 21 May 2026 18:22:40 +0000",Wired AI,2026-05-22T10:45:44.313725
I Cloned Myself With Gemini’s AI Avatar Tool. The Result Was Unnervingly Me,I used the Gemini app to generate lifelike videos featuring a digital clone of myself. Google sees this as the future of creation. I’m still creeped out.,https://www.wired.com/story/i-cloned-myself-with-geminis-ai-avatar-tool-the-result-was-unnervingly-me/,"Thu, 21 May 2026 15:48:24 +0000",Wired AI,2026-05-22T10:45:44.313731
NYC and LA Are Teaming Up to Fight for EVs,"After the Trump administration turned away from electrification, two of the nation’s biggest governments will advocate for more electric vans, police cars, and eventually, snowplows.",https://www.wired.com/story/nyc-and-la-are-teaming-up-to-fight-for-evs/,"Thu, 21 May 2026 13:33:42 +0000",Wired AI,2026-05-22T10:45:44.313737
"Best Duffel Bags: Eastpak, Patagonia, Baboon to the Moon (2026)",Need to schlep some stuff? These field-tested duffels can handle your baggage.,https://www.wired.com/gallery/best-duffel-bags/,"Thu, 21 May 2026 12:02:00 +0000",Wired AI,2026-05-22T10:45:44.313743
"11 Best Meal Delivery Services, Tested by an Ex-Restaurant Critic","Here are the best meal kits in 2026, including Martha Stewart’s delivery box, a GLP-1–supportive plan, and a budget-friendly option.",https://www.wired.com/gallery/best-meal-kit-services-1/,"Thu, 21 May 2026 12:02:00 +0000",Wired AI,2026-05-22T10:45:44.313748
"5 Best Android Tablets in 2026: OnePlus, Lenovo, and Pixel Compared","Whether you need a portable, around-the-house entertainment center or a full-on laptop replacement, these are the best Android tablets.",https://www.wired.com/story/the-best-android-tablets/,"Thu, 21 May 2026 11:33:00 +0000",Wired AI,2026-05-22T10:45:44.313754
"3 Best Smart Ring Brands: Oura, RingConn, and Samsung (2026)","A svelte smart ring can track important activity, sleep, and health metrics. Plus—unlike most smartwatches—it doesn’t need to be charged every day.",https://www.wired.com/gallery/best-smart-rings/,"Thu, 21 May 2026 11:01:00 +0000",Wired AI,2026-05-22T10:45:44.313760
"Best Dyson Vacuums (2026): V15 Detect, Gen5Detect, PencilVac",Feeling the pull of a new clean machine? We’ll help you make sense of Dyson’s whirlwind vacuum lineup.,https://www.wired.com/gallery/best-dyson-vacuums/,"Thu, 21 May 2026 10:38:00 +0000",Wired AI,2026-05-22T10:45:44.313766
Spotify and Universal Music strike deal allowing fan-made AI covers and remixes,"Spotify is partnering with  Universal Music Group￼ to let Premium subscribers create AI-generated song covers and remixes, with participating artists receiving a share of the revenue.",https://techcrunch.com/2026/05/21/spotify-and-universal-music-strike-deal-allowing-fan-made-ai-covers-and-remixes/,"Thu, 21 May 2026 19:45:00 +0000",TechCrunch AI,2026-05-22T10:45:44.461799
Six search engines worth trying now that Google isn’t really Google anymore,"Google is about to look really different, and if you're not a fan of the AI overview feature, then you're not going to like what's coming.",https://techcrunch.com/2026/05/21/six-search-engines-worth-trying-now-that-google-isnt-really-google-anymore/,"Thu, 21 May 2026 19:19:05 +0000",TechCrunch AI,2026-05-22T10:45:44.461812
"Trump delays AI security executive order, saying language ‘could have been a blocker’","President Trump delayed signing an executive order that would have required pre-release government security reviews of AI models, citing dissatisfaction with the order's language.",https://techcrunch.com/2026/05/21/trump-delays-ai-security-executive-order-i-dont-want-to-get-in-the-way-of-that-leading/,"Thu, 21 May 2026 17:30:45 +0000",TechCrunch AI,2026-05-22T10:45:44.461818
Spotify adds AI-powered Q&A and briefing generation features to podcasts,Spotify will let you generate daily or weekly briefs based on your prompts,https://techcrunch.com/2026/05/21/spotify-adds-ai-powered-qa-and-briefing-generation-features-to-podcasts/,"Thu, 21 May 2026 15:27:00 +0000",TechCrunch AI,2026-05-22T10:45:44.461825
Spotify takes on Google’s NotebookLM with its new app,Spotify is releasing the new desktop app as a research preview in more than 20 markets.,https://techcrunch.com/2026/05/21/spotify-debuts-a-new-desktop-app-for-creating-personal-podcasts/,"Thu, 21 May 2026 15:27:00 +0000",TechCrunch AI,2026-05-22T10:45:44.461833
Spotify launches an ElevenLabs-powered audiobook creation tool,"The AI-powered audiobook generation won't bind authors to an exclusive contract, meaning they are free to publish their generated audiobooks anywhere.",https://techcrunch.com/2026/05/21/spotify-launches-an-elevenlabs-powered-audiobook-creation-tool/,"Thu, 21 May 2026 15:27:00 +0000",TechCrunch AI,2026-05-22T10:45:44.461839
"The Path, founded by Tony Robbins and Calm alums, hopes to offer safer AI therapy","The Path says its AI model has scored 95 on the mental health safety AI benchmark, Vera-MH. This compares to a top score of 65 for the consumer bots.",https://techcrunch.com/2026/05/21/the-path-founded-by-tony-robbins-and-calm-alums-wants-to-offer-safer-ai-therapy/,"Thu, 21 May 2026 14:00:00 +0000",TechCrunch AI,2026-05-22T10:45:44.461845
Hark raises $700M Series A for its secretive ‘universal’ AI interface,"Hark expects to release its first multimodal models this summer, which it says will power a personal AI platform that works with existing products and services. The company expects to follow that with hardware devices built specifically for those systems.",https://techcrunch.com/2026/05/21/hark-raises-700m-series-a-for-its-secretive-universal-ai-interface/,"Thu, 21 May 2026 14:00:00 +0000",TechCrunch AI,2026-05-22T10:45:44.461851
